emoji,description
рҹӨҡрҹҸҫ,"raised back of hand: medium-dark skin tone. raised back of hand: medium-dark skin tone. backhand, raised, medium-dark skin tone. A return made with the back of the hand facing the direction of the stroke"
рҹӨҡрҹҸҪ,"raised back of hand: medium skin tone. raised back of hand: medium skin tone. backhand, raised, medium skin tone. A return made with the back of the hand facing the direction of the stroke"
рҹӨҡрҹҸј,"raised back of hand: medium-light skin tone. raised back of hand: medium-light skin tone. backhand, medium-light skin tone, raised. A return made with the back of the hand facing the direction of the stroke"
рҹ’ҹ,"heart decoration. heart decoration. heart. Love is a variety of different feelings, states, and attitudes that ranges from interpersonal affection to pleasure."
рҹӨҡрҹҸ»,"raised back of hand: light skin tone. raised back of hand: light skin tone. light skin tone, backhand, raised. A return made with the back of the hand facing the direction of the stroke"
рҹ’һ,"revolving hearts. revolving hearts. revolving. Love is a variety of different feelings, states, and attitudes that ranges from interpersonal affection to pleasure."
рҹ’қ,"heart with ribbon. heart with ribbon. valentine, ribbon. Love is a variety of different feelings, states, and attitudes that ranges from interpersonal affection to pleasure."
рҹ’ң,purple heart. purple heart. purple. Persistent determination to adhere to a course of action; insistence.
рҹ’ӣ,yellow heart. yellow heart. yellow. Intense sorrow caused by loss of a loved one (especially by death)
рҹ’ҡ,"green heart. green heart. green. Envy is an emotion which ""occurs when a person lacks another's superior quality, achievement, or possession and either desires it or wishes that the other lacked it"" Bertrand Russell said that envy was one of the most potent causes of unhappiness."
вңҢрҹҸҝ,"victory hand: dark skin tone. victory hand: dark skin tone. dark skin tone, v, hand, victory. One of the long extremities of the hand, sometimes excluding the thumb."
вңҢрҹҸҫ,"victory hand: medium-dark skin tone. victory hand: medium-dark skin tone. v, hand, medium-dark skin tone, victory. One of the long extremities of the hand, sometimes excluding the thumb."
вңҢрҹҸҪ,"victory hand: medium skin tone. victory hand: medium skin tone. v, hand, victory, medium skin tone. One of the long extremities of the hand, sometimes excluding the thumb."
вңҢрҹҸј,"victory hand: medium-light skin tone. victory hand: medium-light skin tone. v, hand, medium-light skin tone, victory. One of the long extremities of the hand, sometimes excluding the thumb."
вңҢрҹҸ»,"victory hand: light skin tone. victory hand: light skin tone. v, light skin tone, hand, victory. One of the long extremities of the hand, sometimes excluding the thumb."
рҹҷҮрҹҸҫвҖҚвҷҖпёҸ,"woman bowing: medium-dark skin tone. woman bowing: medium-dark skin tone. favor, apology, gesture, medium-dark skin tone, woman, sorry, bowing. A woman is a female human."
рҹ’ҷ,"blue heart. blue heart. blue. Platonic relationship wherein one person wishes to enter into a romantic or sexual relationship, while the other does not"
рҹ’ҳ,"heart with arrow. heart with arrow. cupid, arrow. A mark to indicate a direction or relation"
рҹ’—,"growing heart. growing heart. pulse, nervous, excited, growing. The number of heartbeats per unit of time (beats per minute)"
рҹ’–,"sparkling heart. sparkling heart. excited, sparkle. A kiss is the touch or pressing of one's lips against another person or an object."
рҹ’•,"two hearts. two hearts. love. Love is a variety of different feelings, states, and attitudes that ranges from interpersonal affection to pleasure."
рҹ’”,"broken heart. broken heart. break, broken. Intense sorrow caused by loss of a loved one (especially by death)"
рҹ’“,"beating heart. beating heart. pulsating, heartbeat, beating. Love is a variety of different feelings, states, and attitudes that ranges from interpersonal affection to pleasure."
рҹ’’,"wedding. wedding. romance, chapel. Religious place of fellowship, prayer and worship"
рҹ’‘,"couple with heart. couple with heart. love, couple. A term for a male partner"
рҹ’җ,"bouquet. bouquet. flower. A nosegay, tussie-mussie, or posy is a small flower bouquet, typically given as a gift."
рҹҷ…рҹҸјвҖҚвҷҖпёҸ,"woman gesturing NO: medium-light skin tone. woman gesturing NO: medium-light skin tone. hand, forbidden, medium-light skin tone, gesture, woman, prohibited, no. A woman is a female human."
рҹ‘ЁрҹҸҝ,"man: dark skin tone. man: dark skin tone. dark skin tone, man. The hair growing on the lower part of a man's face"
рҹ‘ЁрҹҸҫ,"man: medium-dark skin tone. man: medium-dark skin tone. medium-dark skin tone, man. The hair growing on the lower part of a man's face"
рҹ’Ҹ,kiss. kiss. couple. A pair who associate with one another
рҹ‘ЁрҹҸҪ,"man: medium skin tone. man: medium skin tone. medium skin tone, man. The hair growing on the lower part of a man's face"
рҹ’Һ,"gem stone. gem stone. jewel, gem, diamond. Jewellery or jewelry is small decorative items worn for personal adornment, such as brooches, rings, necklaces, earrings, and bracelets."
рҹ‘ЁрҹҸј,"man: medium-light skin tone. man: medium-light skin tone. medium-light skin tone, man. The hair growing on the lower part of a man's face"
рҹ’Қ,ring. ring. diamond. To ask for a person's hand in marriage.
рҹ‘·рҹҸҫвҖҚвҷӮпёҸ,"man construction worker: medium-dark skin tone. man construction worker: medium-dark skin tone. medium-dark skin tone, worker, man, construction. Tradesman, labourer, or professional employed in the physical construction of the built environment"
рҹ‘ЁрҹҸ»,"man: light skin tone. man: light skin tone. light skin tone, man. The hair growing on the lower part of a man's face"
рҹ’Ң,"love letter. love letter. heart, mail, love, letter. A flat (usually rectangular) container for a letter, thin package, etc."
рҹ’Ӣ,"kiss mark. kiss mark. kiss, lips. A kiss is the touch or pressing of one's lips against another person or an object."
рҹ’Ҡ,"pill. pill. medicine, doctor, sick. Health is a term referring to levels of functional or metabolic efficiency of living beings."
рҹ’ү,"syringe. syringe. medicine, doctor, tool, shot, sick, needle. Blood is a bodily fluid in animals that delivers necessary substances such as nutrients and oxygen to the cells and transports metabolic waste products away from those same cells."
рҹ’Ҳ,"barber pole. barber pole. barber, pole, haircut. A pass behind or through an object."
рҹ’Ү,"person getting haircut. person getting haircut. parlor, beauty, barber, haircut. Scissors are hand-operated shearing instruments."
рҹ’Ҷ,"person getting massage. person getting massage. salon, face, massage. Part of the body at the front of the head"
рҹ’…,"nail polish. nail polish. care, polish, cosmetics, manicure, nail. Cosmetic beauty treatment for the fingernails and hands"
рҹ’„,"lipstick. lipstick. makeup, cosmetics. A woman is a female human."
рҹ’ғ,"woman dancing. woman dancing. dancing, woman. A woman is a female human."
рҹ’Ӯ,guard. guard. guard. A native or inhabitant of Russia
рҹ’Ғ,"person tipping hand. person tipping hand. hand, sassy, help, tipping, information. A woman is a female human."
рҹ’Җ,"skull. skull. fairy tale, death, monster, face. Part of the body at the front of the head"
рҹ‘ҝ,"angry face with horns. angry face with horns. fairy tale, devil, imp, fantasy, demon, face. Part of the body at the front of the head"
рҹҸғрҹҸ»вҖҚвҷҖпёҸ,"woman running: light skin tone. woman running: light skin tone. racing, running, light skin tone, woman, marathon. A woman is a female human."
рҹ‘ҫ,"alien monster. alien monster. creature, fairy tale, extraterrestrial, monster, fantasy, alien, face, ufo. A story about fairies; told to amuse children"
рҹ‘Ҫ,"alien. alien. creature, fairy tale, extraterrestrial, monster, fantasy, face, ufo. Part of the body at the front of the head"
рҹ‘ј,"baby angel. baby angel. fairy tale, fantasy, face, baby, angel. Young child"
рҹ‘»,"ghost. ghost. creature, fairy tale, monster, fantasy, face. An emotion experienced in anticipation of some specific pain or danger (usually accompanied by a desire to flee or fight)"
рҹӨҰрҹҸҪвҖҚвҷӮпёҸ,"man facepalming: medium skin tone. man facepalming: medium skin tone. exasperation, disbelief, facepalm, medium skin tone, man. Doubt, a status between belief and disbelief, involves uncertainty or distrust or lack of sureness of an alleged fact, an action, a motive, or a decision."
рҹ‘ә,"goblin. goblin. creature, japanese, fairy tale, monster, fantasy, face. A story about fairies; told to amuse children"
рҹ‘№,"ogre. ogre. creature, japanese, fairy tale, monster, fantasy, face. A story about fairies; told to amuse children"
рҹ‘ё,"princess. princess. fairy tale, fantasy. A story about fairies; told to amuse children"
рҹ‘·,"construction worker. construction worker. hat, worker, construction. A member of the working class (not necessarily employed)"
рҹ‘¶,"baby. baby. young, baby. Young child"
рҹ‘ө,"old woman. old woman. old, woman. A woman is a female human."
рҹ‘©рҹҸјвҖҚрҹҺ“,"woman student: medium-light skin tone. woman student: medium-light skin tone. medium-light skin tone, graduate, student, woman. A woman is a female human."
рҹ‘ҙ,"old man. old man. old, man. Nickname"
рҹ‘і,person wearing turban. person wearing turban. turban. Sexual maturity is the age or stage when an organism can reproduce.
рҹ‘І,"man with Chinese cap. man with Chinese cap. hat, gua pi mao, man. Young male human"
рҹ‘·вҖҚвҷҖпёҸ,"woman construction worker. woman construction worker. woman, worker, construction. A woman is a female human."
рҹ‘ұ,blond-haired person. blond-haired person. blond. Young male human
рҹ‘°,"bride with veil. bride with veil. bride, wedding, veil. A woman is a female human."
рҹ‘Ҝ,"people with bunny ears partying. people with bunny ears partying. bunny ear, partying, dancer. A woman is a female human."
рҹ‘®,"police officer. police officer. officer, police, cop. Any person in the armed services who holds a position of authority or command"
рҹ‘ӯ,"two women holding hands. two women holding hands. hand, couple, woman, hold. Love is a variety of different feelings, states, and attitudes that ranges from interpersonal affection to pleasure."
рҹ‘¬,"two men holding hands. two men holding hands. twins, hand, gemini, couple, zodiac, hold, man. Love is a variety of different feelings, states, and attitudes that ranges from interpersonal affection to pleasure."
рҹ‘«,"man and woman holding hands. man and woman holding hands. hand, couple, woman, hold, man. Love is a variety of different feelings, states, and attitudes that ranges from interpersonal affection to pleasure."
рҹ‘Ә,family. family. family. Nickname
вҡң,"fleur-de-lis. fleur-de-lis. fleur-de-lis. A flower of any of the species belonging to the genus Iris; the flowers occur in many colors, have long and slender pointed leaves, and either a corm or a rhizome."
вҡӣ,"atom symbol. atom symbol. atom, atheist. A particular branch of scientific knowledge"
рҹ‘©,woman. woman. woman. A woman is a female human.
рҹ‘Ё,man. man. man. The hair growing on the lower part of a man's face
рҹ‘§,"girl. girl. zodiac, young, virgo. A woman is a female human."
рҹ‘Ұ,"boy. boy. boy, young. Young male human"
рҹ‘Ҙ,"busts in silhouette. busts in silhouette. bust, silhouette. Sexual maturity is the age or stage when an organism can reproduce."
вҡҷ,gear. gear. tool. Physical item that can be used to achieve a goal
рҹ‘Ө,"bust in silhouette. bust in silhouette. bust, silhouette. Shade within clear boundaries"
рҹ‘Ј,"footprints. footprints. print, footprint, clothing. The impression of the foot."
вҡ—,"alembic. alembic. tool, chemistry. A particular branch of scientific knowledge"
рҹ‘ў,"womanвҖҷs boot. womanвҖҷs boot. boot, woman, shoe, clothing. A woman is a female human."
вҡ–,"balance scale. balance scale. tool, libra, justice, weight, balance, zodiac, scales. Justice, impartiality and fairness."
рҹ‘Ў,"womanвҖҷs sandal. womanвҖҷs sandal. sandal, woman, shoe, clothing. A woman is a female human."
вҡ•,"medical symbol. medical symbol. staff, medicine, aesculapius"
рҹ‘ ,"high-heeled shoe. high-heeled shoe. heel, woman, shoe, clothing. A woman is a female human."
вҡ”,"crossed swords. crossed swords. weapon, swords, crossed. An instrument of attack or defense in combat, as a gun, missile, or sword."
вҡ“,"anchor. anchor. tool, ship. A ship is a large buoyant watercraft."
вҡ’,"hammer and pick. hammer and pick. hammer, tool, pick. The hammer and pick, rarely referred to as hammer and chisel, is a symbol of mining, often used in heraldry."
рҹ‘ҹ,"running shoe. running shoe. sneaker, athletic, shoe, clothing. Clothing, garments, dress, material."
рҹ‘һ,"manвҖҷs shoe. manвҖҷs shoe. shoe, clothing, man. Clothing, garments, dress, material."
рҹ‘қ,"clutch bag. clutch bag. bag, pouch, clothing. Clothing that is worn or carried, but not part of your main clothing."
рҹ‘ң,"handbag. handbag. purse, bag, clothing. Clothing that is worn or carried, but not part of your main clothing."
рҹҮәрҹҮҝ,"Uzbekistan. Uzbekistan. flag. Country in Central Asia, with the capital Tashkent."
рҹ‘ӣ,"purse. purse. coin, clothing. Clothing that is worn or carried, but not part of your main clothing."
рҹҷ…рҹҸҝ,"person gesturing NO: dark skin tone. person gesturing NO: dark skin tone. dark skin tone, hand, forbidden, gesture, not, prohibited, no. A member of the ninja who were trained in martial arts and hired for espionage or sabotage or assassinations; a person skilled in ninjutsu"
рҹҮәрҹҮҫ,Uruguay. Uruguay. flag. Emblem usually consisting of a rectangular piece of cloth of distinctive design
рҹ‘ҡ,"womanвҖҷs clothes. womanвҖҷs clothes. woman, clothing. A blouse is a loose-fitting upper garment that was formerly worn by workmen, peasants, artists, women and children."
рҹҷ…рҹҸҫ,"person gesturing NO: medium-dark skin tone. person gesturing NO: medium-dark skin tone. hand, forbidden, gesture, medium-dark skin tone, not, prohibited, no. A member of the ninja who were trained in martial arts and hired for espionage or sabotage or assassinations; a person skilled in ninjutsu"
рҹҷ…рҹҸҪ,"person gesturing NO: medium skin tone. person gesturing NO: medium skin tone. hand, forbidden, gesture, not, prohibited, no, medium skin tone. A member of the ninja who were trained in martial arts and hired for espionage or sabotage or assassinations; a person skilled in ninjutsu"
рҹҷ…рҹҸј,"person gesturing NO: medium-light skin tone. person gesturing NO: medium-light skin tone. hand, forbidden, medium-light skin tone, gesture, not, prohibited, no. A member of the ninja who were trained in martial arts and hired for espionage or sabotage or assassinations; a person skilled in ninjutsu"
рҹҷ…рҹҸ»,"person gesturing NO: light skin tone. person gesturing NO: light skin tone. light skin tone, hand, forbidden, gesture, not, prohibited, no. A member of the ninja who were trained in martial arts and hired for espionage or sabotage or assassinations; a person skilled in ninjutsu"
рҹ’ҮрҹҸ»вҖҚвҷӮпёҸ,"man getting haircut: light skin tone. man getting haircut: light skin tone. light skin tone, man, haircut. Way hair is cut."
рҹӨӣрҹҸҝ,"left-facing fist: dark skin tone. left-facing fist: dark skin tone. dark skin tone, leftwards, fist. The raised fist is a symbol of solidarity and support."
рҹ‘ҷ,"bikini. bikini. swim, clothing. A swimsuit, bathing suit, swimming costume, bathing costume, swimming suit, swimmers, swimming togs, bathers, cossie, or swimming trunks for men, is an item of clothing designed to be worn by people engaging in a water-based activity or water sports, such as swimming, water polo, diving, surfing, water skiing, or during activities in the sun, such as sun bathing."
рҹӨӣрҹҸҫ,"left-facing fist: medium-dark skin tone. left-facing fist: medium-dark skin tone. leftwards, fist, medium-dark skin tone. The raised fist is a symbol of solidarity and support."
рҹ‘ҳ,kimono. kimono. clothing. A loose robe; imitated from robes originally worn by Japanese
рҹӨӣрҹҸҪ,"left-facing fist: medium skin tone. left-facing fist: medium skin tone. leftwards, fist, medium skin tone. The raised fist is a symbol of solidarity and support."
рҹ‘—,"dress. dress. clothing. Clothing, garments, dress, material."
рҹӨӣрҹҸј,"left-facing fist: medium-light skin tone. left-facing fist: medium-light skin tone. leftwards, fist, medium-light skin tone. The raised fist is a symbol of solidarity and support."
рҹ‘–,"jeans. jeans. pants, trousers, clothing. Clothing, garments, dress, material."
рҹӨӣрҹҸ»,"left-facing fist: light skin tone. left-facing fist: light skin tone. light skin tone, leftwards, fist. The raised fist is a symbol of solidarity and support."
рҹ‘•,"t-shirt. t-shirt. shirt, clothing, tshirt. Clothing, garments, dress, material."
рҹ‘©рҹҸјвҖҚрҹҚі,"woman cook: medium-light skin tone. woman cook: medium-light skin tone. cook, chef, medium-light skin tone, woman. Person who cooks professionally for other people"
рҹҮәрҹҮё,United States. United States. flag. Emblem usually consisting of a rectangular piece of cloth of distinctive design
рҹ‘”,"necktie. necktie. clothing. A person who wears matching jacket and trousers, especially a boss or a supervisor."
рҹ‘“,"glasses. glasses. eye, eyewear, clothing, eyeglasses. A person who has an unusual, peculiar, or odd personality, or behaviour pattern."
рҹ‘’,"womanвҖҷs hat. womanвҖҷs hat. hat, woman, clothing. Clothing that is worn or carried, but not part of your main clothing."
рҹҡ¶рҹҸҝвҖҚвҷӮпёҸ,"man walking: dark skin tone. man walking: dark skin tone. dark skin tone, walk, hike, man. Sexual maturity is the age or stage when an organism can reproduce."
рҹ‘‘,"crown. crown. king, queen, clothing. Princess is the feminine form of prince."
вңҚрҹҸҝ,"writing hand: dark skin tone. writing hand: dark skin tone. dark skin tone, hand, write. Many paper size standards conventions have existed at different times and in different countries."
рҹ‘җ,"open hands. open hands. hand, open. Diurnal insect typically having a slender body with knobbed antennae and broad colorful wings"
вңҚрҹҸҫ,"writing hand: medium-dark skin tone. writing hand: medium-dark skin tone. hand, write, medium-dark skin tone. Many paper size standards conventions have existed at different times and in different countries."
рҹҮәрҹҮі,United Nations. United Nations. flag. Emblem usually consisting of a rectangular piece of cloth of distinctive design
вңҚрҹҸҪ,"writing hand: medium skin tone. writing hand: medium skin tone. hand, write, medium skin tone. Many paper size standards conventions have existed at different times and in different countries."
рҹҮәрҹҮІ,"U.S. Outlying Islands. U.S. Outlying Islands. flag. The national flag of the United States of America, often referred to as the American flag, consists of thirteen equal horizontal stripes of red alternating with white, with a blue rectangle in the canton bearing fifty small, white, five-pointed stars arranged in nine offset horizontal rows of six stars alternating with rows of five stars."
вңҚрҹҸј,"writing hand: medium-light skin tone. writing hand: medium-light skin tone. hand, medium-light skin tone, write. Many paper size standards conventions have existed at different times and in different countries."
вңҚрҹҸ»,"writing hand: light skin tone. writing hand: light skin tone. light skin tone, hand, write. Many paper size standards conventions have existed at different times and in different countries."
рҹ‘Ҹ,"clapping hands. clapping hands. clap, hand. The act of applauding; approbation and praise publicly expressed by the clapping of hands, stamping or tapping of the feet, acclamation, huzzas, or other means; marked commendation."
рҹ‘Һ,"thumbs down. thumbs down. thumb, hand, -1, down. An experience that is irritating or frustrating or disappointing"
рҹ‘Қ,"thumbs up. thumbs up. up, thumb, hand, +1. Acceptance in human psychology is a person's assent to the reality of a situation, recognizing a process or condition without attempting to change it, protest."
рҹ‘Ң,"OK hand. OK hand. hand, ok. A circular hand sign"
рҹ‘Ӣ,"waving hand. waving hand. hand, waving, wave. An utterance of goodbye, the wishing of farewell to someone."
вҷҝ,"wheelchair symbol. wheelchair symbol. access. The International Symbol of Access, also known as the Wheelchair Symbol, consists of a blue square overlaid in white with a stylized image of a person using a wheelchair."
рҹ‘Ҡ,"oncoming fist. oncoming fist. hand, fist, punch, clenched. Basic emotion"
рҹҮәрҹҮ¬,Uganda. Uganda. flag. Emblem usually consisting of a rectangular piece of cloth of distinctive design
рҹҷҚвҖҚвҷҖпёҸ,"woman frowning. woman frowning. frowning, gesture, woman. A woman is a female human."
вҷ»,recycling symbol. recycling symbol. recycle. A symbol universally associated with recyclable materials. It is comprised of three crooked arrows arranged as a triangular clockwise MГ¶bius strip.
рҹ‘ү,"backhand index pointing right. backhand index pointing right. point, hand, backhand, index, finger. The finger next to the thumb"
рҹ‘Ҳ,"backhand index pointing left. backhand index pointing left. point, hand, backhand, index, finger. One of the long extremities of the hand, sometimes excluding the thumb."
рҹ‘Ү,"backhand index pointing down. backhand index pointing down. point, hand, backhand, index, finger, down. One of the long extremities of the hand, sometimes excluding the thumb."
рҹ‘©рҹҸҝ,"woman: dark skin tone. woman: dark skin tone. dark skin tone, woman. A woman is a female human."
рҹ‘Ҷ,"backhand index pointing up. backhand index pointing up. up, point, hand, backhand, index, finger. The finger next to the thumb"
рҹ‘©рҹҸҫ,"woman: medium-dark skin tone. woman: medium-dark skin tone. medium-dark skin tone, woman. A woman is a female human."
рҹ‘…,tongue. tongue. body. The tongue is a muscular hydrostat on the floors of the mouths of most vertebrates which manipulates food for mastication.
рҹ‘©рҹҸҪ,"woman: medium skin tone. woman: medium skin tone. woman, medium skin tone. A woman is a female human."
рҹ‘„,mouth. mouth. lips. A kiss is the touch or pressing of one's lips against another person or an object.
рҹ‘©рҹҸј,"woman: medium-light skin tone. woman: medium-light skin tone. medium-light skin tone, woman. A woman is a female human."
рҹ‘ғ,nose. nose. body. The male genitals.
рҹ‘©рҹҸ»,"woman: light skin tone. woman: light skin tone. light skin tone, woman. A woman is a female human."
рҹҮәрҹҮҰ,Ukraine. Ukraine. flag. The state flag of Ukraine is a banner of two equally sized horizontal bands of blue and yellow color.
рҹ‘Ӯ,ear. ear. body. The act of hearing attentively
рҹ‘Ғ,eye. eye. body. An organ of vision that detects light
рҹҷҚрҹҸ»вҖҚвҷҖпёҸ,"woman frowning: light skin tone. woman frowning: light skin tone. light skin tone, frowning, gesture, woman. A woman is a female human."
рҹ‘Җ,"eyes. eyes. eye, face. A person, especially as one among many."
вӣ№рҹҸҫвҖҚвҷӮпёҸ,"man bouncing ball: medium-dark skin tone. man bouncing ball: medium-dark skin tone. medium-dark skin tone, ball, man"
рҹ‘®рҹҸҫвҖҚвҷҖпёҸ,"woman police officer: medium-dark skin tone. woman police officer: medium-dark skin tone. officer, medium-dark skin tone, woman, police, cop. Any person in the armed services who holds a position of authority or command"
рҹҗҝ,chipmunk. chipmunk. chipmunk. A burrowing ground squirrel of western America and Asia; has cheek pouches and a light and dark stripe running down the body
рҹҗҫ,"paw prints. paw prints. paw, print, feet. The domestic dog is a canid that is known as man's best friend."
рҹҗҪ,"pig nose. pig nose. nose, face, pig. Nose"
рҹҗј,"panda face. panda face. face, panda. A mammal (Ailuropoda melanoleuca) classified in the bear family native to central-western and southwestern China."
рҹҗ»,"bear face. bear face. face, bear. A large beast of prey of the family Ursidae, related to the dog and raccoon, having shaggy hair, a very small tail, and flat feet."
рҹҗә,"wolf face. wolf face. wolf, face. Any of various predatory carnivorous canine mammals of North America and Eurasia that usually hunt in packs"
рҹҗ№,"hamster face. hamster face. pet, face, hamster. Animal kept for companionship and a person's enjoyment"
рҹҗё,"frog face. frog face. frog, face. A harsh hoarse utterance (as of a frog)"
рҹҗ·,"pig face. pig face. face, pig. Offspring of male donkey and female horse."
рҹҗ¶,"dog face. dog face. pet, dog, face. The domestic dog is a canid that is known as man's best friend."
