emoji,description
рҹ• ,"five-thirty. five-thirty. 5, five, thirty, 5:30, clock, 30. A clock is an instrument to indicate, keep, and co-ordinate time."
рҹ‘ұрҹҸҪвҖҚвҷӮпёҸ,"blond-haired man: medium skin tone. blond-haired man: medium skin tone. blond, medium skin tone, man. A light and yellowish, brownish or golden hair color."
рҹ•ҹ,"four-thirty. four-thirty. 4, thirty, clock, 4:30, four, 30. 30 is the natural number following 29 and preceding 31."
рҹ•һ,"three-thirty. three-thirty. thirty, 3, clock, three, 3:30, 30. 30 is the natural number following 29 and preceding 31."
рҹ•қ,"two-thirty. two-thirty. 2:30, two, thirty, clock, 2, 30. 30 is the natural number following 29 and preceding 31."
рҹ•ң,"one-thirty. one-thirty. thirty, one, clock, 1:30, 1, 30. A clock is an instrument to indicate, keep, and co-ordinate time."
рҹ•ӣ,"twelve oвҖҷclock. twelve oвҖҷclock. 12:00, 12, 00, clock, oвҖҷclock, twelve. A light meal usually eaten around midday, notably when not as main meal of the day."
рҹ•ҡ,"eleven oвҖҷclock. eleven oвҖҷclock. 00, clock, 11, 11:00, oвҖҷclock, eleven. An Australian free-to-air digital television channel"
рҹӨҪрҹҸҝвҖҚвҷӮпёҸ,"man playing water polo: dark skin tone. man playing water polo: dark skin tone. dark skin tone, water polo, man. A water sport consisting of two teams of swimmers who have to throw the ball into the opponents goal."
вҳқрҹҸҝ,"index pointing up: dark skin tone. index pointing up: dark skin tone. up, point, dark skin tone, hand, index, finger. The finger next to the thumb"
вҳқрҹҸҫ,"index pointing up: medium-dark skin tone. index pointing up: medium-dark skin tone. up, point, hand, index, medium-dark skin tone, finger. The finger next to the thumb"
рҹ•ҷ,"ten oвҖҷclock. ten oвҖҷclock. ten, 00, clock, 10, oвҖҷclock, 10:00. The start of the eleventh hour of the day in both the 12-hour and the 24-hour clock; 10:00."
вҳқрҹҸҪ,"index pointing up: medium skin tone. index pointing up: medium skin tone. up, point, hand, index, finger, medium skin tone. The finger next to the thumb"
рҹ•ҳ,"nine oвҖҷclock. nine oвҖҷclock. 00, clock, nine, 9:00, oвҖҷclock, 9. The cardinal number that is the sum of eight and one"
вҳқрҹҸј,"index pointing up: medium-light skin tone. index pointing up: medium-light skin tone. up, point, hand, index, medium-light skin tone, finger. The finger next to the thumb"
рҹ•—,"eight oвҖҷclock. eight oвҖҷclock. eight, 00, clock, oвҖҷclock, 8, 8:00. Cardinal number 8."
вҳқрҹҸ»,"index pointing up: light skin tone. index pointing up: light skin tone. up, point, light skin tone, hand, index, finger. The finger next to the thumb"
рҹ•–,"seven oвҖҷclock. seven oвҖҷclock. 7:00, 00, clock, seven, oвҖҷclock, 7. The cardinal number that is the sum of six and one"
рҹҷҶвҖҚвҷҖпёҸ,"woman gesturing OK. woman gesturing OK. hand, ok, gesture, woman. A woman is a female human."
рҹ••,"six oвҖҷclock. six oвҖҷclock. 6, six, 00, clock, 6:00, oвҖҷclock. Dawn is the time that marks the beginning of the twilight before sunrise."
рҹ•”,"five oвҖҷclock. five oвҖҷclock. 5, five, 00, clock, oвҖҷclock, 5:00. A virtual object that is similar in shape to playing cards."
рҹ•“,"four oвҖҷclock. four oвҖҷclock. 4:00, 4, 00, clock, four, oвҖҷclock. In mathematics, the quaternions are a number system that extends the complex numbers."
рҹ•’,"three oвҖҷclock. three oвҖҷclock. 3:00, 3, 00, clock, three, oвҖҷclock. Three O'Clock is a 2005 film written, directed by, and starring Glen Chua, with Alexandra Caldwell, and George Amoako."
рҹ‘©рҹҸ»вҖҚрҹ”¬,"woman scientist: light skin tone. woman scientist: light skin tone. mathematician, engineer, light skin tone, woman, physicist, chemist, biologist, scientist. A woman is a female human."
рҹ•‘,"two oвҖҷclock. two oвҖҷclock. two, 00, clock, 2, 2:00, oвҖҷclock. The natural number following 1 and preceding 3"
рҹ•җ,"one oвҖҷclock. one oвҖҷclock. 00, one, clock, 1, oвҖҷclock, 1:00. 1 is a number, a numeral, and the name of the glyph representing that number."
рҹҡҙрҹҸ»вҖҚвҷҖпёҸ,"woman biking: light skin tone. woman biking: light skin tone. bicycle, light skin tone, cyclist, woman, biking. A woman is a female human."
рҹ•Һ,"menorah. menorah. candelabrum, religion, candlestick. The Hanukkah menorah or chanukiah is, strictly speaking, a nine-branched candelabrum lit during the eight-day holiday of Hanukkah, as opposed to the seven-branched menorah used in the ancient Temple or as a symbol."
рҹ‘©рҹҸ»вҖҚрҹ”§,"woman mechanic: light skin tone. woman mechanic: light skin tone. light skin tone, electrician, tradesperson, plumber, woman, mechanic. A woman is a female human."
рҹ•Қ,"synagogue. synagogue. jewish, religion, temple, jew. A temple is a structure reserved for religious or spiritual activities, such as prayer and sacrifice, or analogous rites."
рҹ•Ң,"mosque. mosque. islam, religion, muslim. Believer of Islam."
рҹ•Ӣ,"kaaba. kaaba. islam, religion, muslim. A city of Saudi Arabia, the most important holy city of Islam."
рҹ•Ҡ,"dove. dove. peace, fly, bird. Warm-blooded egg-laying vertebrates characterized by feathers and forelimbs modified as wings"
рҹ‘®рҹҸ»вҖҚвҷӮпёҸ,"man police officer: light skin tone. man police officer: light skin tone. light skin tone, officer, police, man, cop. Any person in the armed services who holds a position of authority or command"
рҹ•ү,"om. om. religion, hindu. ""Grilled Cheesus"" is the third episode of the second season of the American television series Glee, and the 25th episode overall."
рҹ”Ҫ,"down button. down button. button, arrow, red, down. A mark to indicate a direction or relation"
рҹ”ј,"up button. up button. button, arrow, red. A mark to indicate a direction or relation"
рҹ‘өрҹҸҝ,"old woman: dark skin tone. old woman: dark skin tone. dark skin tone, old, woman. A woman is a female human."
рҹ”»,"red triangle pointed down. red triangle pointed down. red, geometric, down. A mark to indicate a direction or relation"
рҹ‘өрҹҸҫ,"old woman: medium-dark skin tone. old woman: medium-dark skin tone. old, medium-dark skin tone, woman. A woman is a female human."
рҹ”ә,"red triangle pointed up. red triangle pointed up. red, geometric"
рҹ‘өрҹҸҪ,"old woman: medium skin tone. old woman: medium skin tone. old, woman, medium skin tone. A woman is a female human."
рҹ‘өрҹҸј,"old woman: medium-light skin tone. old woman: medium-light skin tone. old, medium-light skin tone, woman. A woman is a female human."
рҹҸ„рҹҸҝвҖҚвҷӮпёҸ,"man surfing: dark skin tone. man surfing: dark skin tone. dark skin tone, surfing, man. Sexual maturity is the age or stage when an organism can reproduce."
рҹ‘өрҹҸ»,"old woman: light skin tone. old woman: light skin tone. old, light skin tone, woman. A woman is a female human."
рҹ”№,"small blue diamond. small blue diamond. blue, geometric, diamond"
рҹ”ё,"small orange diamond. small orange diamond. orange, geometric, diamond"
рҹ”·,"large blue diamond. large blue diamond. blue, geometric, diamond"
рҹҮ«рҹҮ·,"France. France. flag. French is a Romance language, belonging to the Indo-European family."
рҹ”¶,"large orange diamond. large orange diamond. orange, geometric, diamond"
рҹ”ө,"blue circle. blue circle. blue, circle, geometric. Blue color or pigment; resembling the color of the clear sky in the daytime"
рҹ”ҙ,"red circle. red circle. red, circle, geometric. An error; a blunder."
рҹҸӢрҹҸҝ,"person lifting weights: dark skin tone. person lifting weights: dark skin tone. dark skin tone, lifter, weight. Sport is all forms of usually competitive physical activity which, through casual or organised participation, aim to use, maintain or improve physical ability and skills while providing entertainment to participants, and in some cases, spectators."
рҹҮ«рҹҮҙ,Faroe Islands. Faroe Islands. flag. Flag of the Faroe Islands
рҹ”і,"white square button. white square button. button, outlined, square, geometric. Plural form of box."
рҹҸӢрҹҸҫ,"person lifting weights: medium-dark skin tone. person lifting weights: medium-dark skin tone. medium-dark skin tone, lifter, weight. Sport is all forms of usually competitive physical activity which, through casual or organised participation, aim to use, maintain or improve physical ability and skills while providing entertainment to participants, and in some cases, spectators."
рҹ”І,"black square button. black square button. button, square, geometric. Plural form of box."
рҹҸӢрҹҸҪ,"person lifting weights: medium skin tone. person lifting weights: medium skin tone. lifter, weight, medium skin tone. Sport is all forms of usually competitive physical activity which, through casual or organised participation, aim to use, maintain or improve physical ability and skills while providing entertainment to participants, and in some cases, spectators."
рҹҮ«рҹҮІ,Micronesia. Micronesia. flag. Emblem usually consisting of a rectangular piece of cloth of distinctive design
рҹ”ұ,"trident emblem. trident emblem. trident, tool, anchor, ship, emblem. A three-pronged spear-like weapon"
рҹҸӢрҹҸј,"person lifting weights: medium-light skin tone. person lifting weights: medium-light skin tone. medium-light skin tone, lifter, weight. Sport is all forms of usually competitive physical activity which, through casual or organised participation, aim to use, maintain or improve physical ability and skills while providing entertainment to participants, and in some cases, spectators."
рҹ”°,"Japanese symbol for beginner. Japanese symbol for beginner. leaf, japanese, tool, beginner, green, chevron, yellow. A heraldic symbol"
рҹҸӢрҹҸ»,"person lifting weights: light skin tone. person lifting weights: light skin tone. light skin tone, lifter, weight. Sport is all forms of usually competitive physical activity which, through casual or organised participation, aim to use, maintain or improve physical ability and skills while providing entertainment to participants, and in some cases, spectators."
рҹҮ«рҹҮ°,Falkland Islands. Falkland Islands. flag. Emblem usually consisting of a rectangular piece of cloth of distinctive design
вқӨ,red heart. red heart. heart. A term for a male partner
вқЈ,"heavy heart exclamation. heavy heart exclamation. exclamation, punctuation, mark. A pass behind or through an object."
рҹӨҫрҹҸҝвҖҚвҷҖпёҸ,"woman playing handball: dark skin tone. woman playing handball: dark skin tone. dark skin tone, woman, handball. A woman is a female human."
рҹ‘©рҹҸҪвҖҚрҹҺ“,"woman student: medium skin tone. woman student: medium skin tone. graduate, student, woman, medium skin tone. A woman is a female human."
рҹ”Ҝ,"dotted six-pointed star. dotted six-pointed star. fortune, star. Massive balls of plasma"
рҹҮ«рҹҮҜ,Fiji. Fiji. flag. An independent state within the British Commonwealth located on the Fiji Islands
рҹ”®,"crystal ball. crystal ball. fortune, tool, fairy tale, fantasy, crystal, ball. A story about fairies; told to amuse children"
рҹӨ·рҹҸҝ,"person shrugging: dark skin tone. person shrugging: dark skin tone. dark skin tone, indifference, shrug, ignorance, doubt. A gesture involving the shoulders"
рҹҮ«рҹҮ®,Finland. Finland. flag. National flag
рҹ”ӯ,"telescope. telescope. science, tool. A monocular optical instrument possessing magnification for observing distant objects, especially in astronomy."
рҹӨ·рҹҸҫ,"person shrugging: medium-dark skin tone. person shrugging: medium-dark skin tone. medium-dark skin tone, indifference, shrug, ignorance, doubt. A gesture involving the shoulders"
рҹ”¬,"microscope. microscope. science, tool. Magnifier of the image of small objects"
рҹӨ·рҹҸҪ,"person shrugging: medium skin tone. person shrugging: medium skin tone. indifference, shrug, ignorance, medium skin tone, doubt. A gesture involving the shoulders"
рҹ”«,"pistol. pistol. tool, weapon, revolver, handgun, gun. An act of aggression (as one against a person who resists)"
рҹӨ·рҹҸј,"person shrugging: medium-light skin tone. person shrugging: medium-light skin tone. medium-light skin tone, indifference, shrug, ignorance, doubt. A gesture involving the shoulders"
рҹ”Ә,"kitchen knife. kitchen knife. hocho, tool, cooking, weapon, knife. The act of killing."
рҹӨ·рҹҸ»,"person shrugging: light skin tone. person shrugging: light skin tone. light skin tone, indifference, shrug, ignorance, doubt. A gesture involving the shoulders"
рҹ”©,"nut and bolt. nut and bolt. tool, nut, bolt. Device that can be screwed on a bolt."
рҹ”Ё,hammer. hammer. tool. A hand tool with a heavy rigid head and a handle; used to deliver an impulsive force by striking
рҹ”§,"wrench. wrench. tool, wrench, spanner. A hand tool"
рҹ”Ұ,"flashlight. flashlight. torch, light, electric, tool. A hand-held light source"
рҹ”Ҙ,"fire. fire. tool, flame. A bright yellow, red or bluish light which emerges during combustion processes."
рҹ”Ө,"input latin letters. input latin letters. input, latin, abc, alphabet, letters. Occurring in a scientific description"
рҹ”Ј,"input symbols. input symbols. input, ??&%. Graphic representation of a character."
вқ—,"exclamation mark. exclamation mark. exclamation, punctuation, mark. Feeling that something unexpected has happened."
рҹ”ў,"input numbers. input numbers. numbers, input, 1234. A concept of quantity involving zero and units"
рҹ”Ў,"input latin lowercase. input latin lowercase. input, latin, lowercase, abcd, letters. Occurring in a scientific description"
вқ•,"white exclamation mark. white exclamation mark. exclamation, outlined, punctuation, mark. Feeling that something unexpected has happened."
рҹ” ,"input latin uppercase. input latin uppercase. input, uppercase, latin, abcd, letters. Smallest linguistic element that may be uttered in isolation with semantic or pragmatic content"
вқ”,"white question mark. white question mark. question, outlined, punctuation, mark. Doubt, a status between belief and disbelief, involves uncertainty or distrust or lack of sureness of an alleged fact, an action, a motive, or a decision."
вқ“,"question mark. question mark. question, punctuation, mark. Doubt, a status between belief and disbelief, involves uncertainty or distrust or lack of sureness of an alleged fact, an action, a motive, or a decision."
рҹҷ…рҹҸҫвҖҚвҷҖпёҸ,"woman gesturing NO: medium-dark skin tone. woman gesturing NO: medium-dark skin tone. hand, forbidden, gesture, medium-dark skin tone, woman, prohibited, no. A woman is a female human."
рҹ”ҹ,keycap 10. keycap 10. keycap 10. A concept of quantity involving zero and units
рҹ”һ,"no one under eighteen. no one under eighteen. forbidden, underage, not, prohibited, age restriction, 18, no, eighteen. A visible indication."
рҹ”қ,"TOP arrow. TOP arrow. up, arrow, top. The upper part of anything"
рҹ”ң,"SOON arrow. SOON arrow. soon, arrow"
рҹ”ӣ,"ON! arrow. ON! arrow. on, arrow, mark"
рҹ”ҡ,"END arrow. END arrow. end, arrow. A visible indication."
вқҺ,"cross mark button. cross mark button. square, mark. A visible indication."
вқҢ,"cross mark. cross mark. x, multiply, cancel, multiplication, mark. An x mark is a mark used to indicate the concept of negation as well as affirmation."
рҹ”ҷ,"BACK arrow. BACK arrow. back, arrow. A visible indication."
рҹ”ҳ,"radio button. radio button. radio, button, geometric. A radio button or option button is a graphical control element that allows the user to choose only one of a predefined set of options, an exclusive or."
рҹ”—,link. link. link. Address of a web page or resource.
рҹ”–,bookmark. bookmark. mark. A brief description given for purposes of identification
рҹ”•,"bell with slash. bell with slash. silent, quiet, forbidden, bell, not, mute, prohibited, no. A percussive instrument made of metal or other hard material, typically but not always in the shape of an inverted cup with a flared rim, which resonates when struck."
рҹ””,"bell. bell. bell. A type of cymbal, tending to be thick and uniformly so, and small"
рҹ”“,"unlocked. unlocked. open, lock, unlock. A detachable lock; has a hinged shackle that can be passed through the staple of a hasp or the links in a chain and then snapped shut"
вқҮ,sparkle. sparkle. sparkle. Massive balls of plasma
рҹ”’,locked. locked. closed. A detachable lock; has a hinged shackle that can be passed through the staple of a hasp or the links in a chain and then snapped shut
рҹ”‘,"key. key. password, lock. Metal device shaped in such a way that when it is inserted into the appropriate lock the lock's mechanism can be rotated"
рҹ”җ,"locked with key. locked with key. closed, lock, key, secure. The ability of an individual or group to seclude themselves, or information about themselves"
вқ„,"snowflake. snowflake. cold, snow. Winter is the coldest season of the year in polar climates and temperate climates, between autumn and spring."
рҹ‘©рҹҸҪвҖҚрҹҚі,"woman cook: medium skin tone. woman cook: medium skin tone. cook, chef, woman, medium skin tone. Person who cooks professionally for other people"
рҹ”Ҹ,"locked with pen. locked with pen. ink, nib, privacy, lock, pen. A fastening device"
рҹ”Һ,"right-pointing magnifying glass. right-pointing magnifying glass. tool, search, magnifying, glass. The act of discovering something"
рҹ”Қ,"left-pointing magnifying glass. left-pointing magnifying glass. tool, search, magnifying, glass. The act of discovering something"
рҹ”Ң,"electric plug. electric plug. plug, electric, electricity. Receptacle providing a place in a wiring system where current can be taken to run electrical devices"
рҹ”Ӣ,"battery. battery. battery. A cell or several cells connected together, each cell containing the essentials for producing voltaic electricity."
рҹ”Ҡ,speaker high volume. speaker high volume. loud. An electromechanical device which produces sound
рҹҸғрҹҸҪвҖҚвҷҖпёҸ,"woman running: medium skin tone. woman running: medium skin tone. racing, running, woman, marathon, medium skin tone. A woman is a female human."
рҹӨҰрҹҸҝвҖҚвҷӮпёҸ,"man facepalming: dark skin tone. man facepalming: dark skin tone. dark skin tone, exasperation, disbelief, facepalm, man. Doubt, a status between belief and disbelief, involves uncertainty or distrust or lack of sureness of an alleged fact, an action, a motive, or a decision."
рҹ”ү,speaker medium volume. speaker medium volume. medium. An electromechanical device which produces sound
рҹ”Ҳ,speaker low volume. speaker low volume. soft. An electromechanical device which produces sound
рҹ”Ү,"muted speaker. muted speaker. silent, speaker, quiet, mute. An electromechanical device which produces sound"
рҹ”Ҷ,"bright button. bright button. bright, brightness. The luminous flux emitted in a given direction divided by the product of the projected area of the source element perpendicular to the direction and the solid angle containing that direction, i.e. luminous intensity divided by unit area; measured in stilbs or apostilbs"
рҹ”…,"dim button. dim button. low, dim, brightness. The luminous flux emitted in a given direction divided by the product of the projected area of the source element perpendicular to the direction and the solid angle containing that direction, i.e. luminous intensity divided by unit area; measured in stilbs or apostilbs"
рҹ”„,"anticlockwise arrows button. anticlockwise arrows button. withershins, counterclockwise, arrow, anticlockwise. Update of a display."
рҹ”ғ,"clockwise vertical arrows. clockwise vertical arrows. clockwise, reload, arrow. A gradient brush option that makes the gradient repeat."
рҹ”Ӯ,"repeat single button. repeat single button. clockwise, once, arrow. An interval of space or time in which one set of events or phenomena is completed."
рҹ”Ғ,"repeat button. repeat button. clockwise, repeat, arrow. Possible direction of a circular motion"
рҹ”Җ,"shuffle tracks button. shuffle tracks button. arrow, crossed. A mark to indicate a direction or relation"
вңҙ,eight-pointed star. eight-pointed star. star. Massive balls of plasma
вңі,eight-spoked asterisk. eight-spoked asterisk. asterisk. Massive balls of plasma
рҹӨёвҖҚвҷӮпёҸ,"man cartwheeling. man cartwheeling. gymnastics, cartwheel, man. A sport that involves exercises intended to display strength and balance and agility"
рҹҮ¬рҹҮҫ,Guyana. Guyana. flag. Emblem usually consisting of a rectangular piece of cloth of distinctive design
вңЁ,"sparkles. sparkles. star, sparkle. Massive balls of plasma"
рҹҮ¬рҹҮј,Guinea-Bissau. Guinea-Bissau. flag. Country in Western Africa. Official name: Republic of Guinea-Bissau.
рҹ‘¶рҹҸҝ,"baby: dark skin tone. baby: dark skin tone. dark skin tone, young, baby. Young child"
рҹ‘¶рҹҸҫ,"baby: medium-dark skin tone. baby: medium-dark skin tone. medium-dark skin tone, young, baby. Young child"
рҹҮ¬рҹҮә,Guam. Guam. flag. Emblem usually consisting of a rectangular piece of cloth of distinctive design
рҹ‘¶рҹҸҪ,"baby: medium skin tone. baby: medium skin tone. young, baby, medium skin tone. Young child"
рҹ‘¶рҹҸј,"baby: medium-light skin tone. baby: medium-light skin tone. medium-light skin tone, young, baby. Young child"
рҹ‘¶рҹҸ»,"baby: light skin tone. baby: light skin tone. light skin tone, young, baby. Young child"
рҹ’ҒвҖҚвҷҖпёҸ,"woman tipping hand. woman tipping hand. sassy, woman, tipping hand. A woman is a female human."
вңЎ,"star of David. star of David. david, jewish, religion, star, jew. Massive balls of plasma"
рҹҮ¬рҹҮ№,Guatemala. Guatemala. flag. Emblem usually consisting of a rectangular piece of cloth of distinctive design
рҹҮ¬рҹҮё,South Georgia & South Sandwich Islands. South Georgia & South Sandwich Islands. flag. British overseas territory in the South Atlantic/Southern Ocean
рҹҮ¬рҹҮ·,Greece. Greece. flag. Emblem usually consisting of a rectangular piece of cloth of distinctive design
рҹҮ¬рҹҮ¶,Equatorial Guinea. Equatorial Guinea. flag. Emblem usually consisting of a rectangular piece of cloth of distinctive design
рҹҮ¬рҹҮө,Guadeloupe. Guadeloupe. flag. Emblem usually consisting of a rectangular piece of cloth of distinctive design
рҹҸҢрҹҸҝ,"person golfing: dark skin tone. person golfing: dark skin tone. dark skin tone, ball, golf. Sport is all forms of usually competitive physical activity which, through casual or organised participation, aim to use, maintain or improve physical ability and skills while providing entertainment to participants, and in some cases, spectators."
рҹҮ¬рҹҮі,Guinea. Guinea. flag. Emblem usually consisting of a rectangular piece of cloth of distinctive design
рҹҸҢрҹҸҫ,"person golfing: medium-dark skin tone. person golfing: medium-dark skin tone. medium-dark skin tone, ball, golf. Sport is all forms of usually competitive physical activity which, through casual or organised participation, aim to use, maintain or improve physical ability and skills while providing entertainment to participants, and in some cases, spectators."
рҹҮ¬рҹҮІ,Gambia. Gambia. flag. Emblem usually consisting of a rectangular piece of cloth of distinctive design
рҹҸҢрҹҸҪ,"person golfing: medium skin tone. person golfing: medium skin tone. ball, golf, medium skin tone. Sport is all forms of usually competitive physical activity which, through casual or organised participation, aim to use, maintain or improve physical ability and skills while providing entertainment to participants, and in some cases, spectators."
рҹҮ¬рҹҮұ,Greenland. Greenland. flag. A large self-governing island in North America.
вңқ,"latin cross. latin cross. religion, christian, cross. A religious person who believes Jesus is the Christ and who is a member of a Christian denomination"
рҹҸҢрҹҸј,"person golfing: medium-light skin tone. person golfing: medium-light skin tone. medium-light skin tone, ball, golf. Sport is all forms of usually competitive physical activity which, through casual or organised participation, aim to use, maintain or improve physical ability and skills while providing entertainment to participants, and in some cases, spectators."
рҹҸҢрҹҸ»,"person golfing: light skin tone. person golfing: light skin tone. light skin tone, ball, golf. Sport is all forms of usually competitive physical activity which, through casual or organised participation, aim to use, maintain or improve physical ability and skills while providing entertainment to participants, and in some cases, spectators."
рҹҸҠрҹҸјвҖҚвҷӮпёҸ,"man swimming: medium-light skin tone. man swimming: medium-light skin tone. medium-light skin tone, swim, man. Sexual maturity is the age or stage when an organism can reproduce."
рҹ’ҮрҹҸҪвҖҚвҷӮпёҸ,"man getting haircut: medium skin tone. man getting haircut: medium skin tone. medium skin tone, man, haircut. Way hair is cut."
рҹӨёрҹҸҝ,"person cartwheeling: dark skin tone. person cartwheeling: dark skin tone. dark skin tone, gymnastics, cartwheel. A sport that involves exercises intended to display strength and balance and agility"
