emoji,description
рҹҷҺрҹҸҫвҖҚвҷӮпёҸ,"man pouting: medium-dark skin tone. man pouting: medium-dark skin tone. pouting, gesture, medium-dark skin tone, man. Sexual maturity is the age or stage when an organism can reproduce."
рҹ‘·рҹҸ»вҖҚвҷӮпёҸ,"man construction worker: light skin tone. man construction worker: light skin tone. light skin tone, worker, man, construction. Tradesman, labourer, or professional employed in the physical construction of the built environment"
рҹӨ·вҖҚвҷӮпёҸ,"man shrugging. man shrugging. indifference, shrug, ignorance, man, doubt. A gesture involving the shoulders"
рҹҷҢрҹҸҝ,"raising hands: dark skin tone. raising hands: dark skin tone. dark skin tone, hooray, hand, gesture, raised, celebration. The act of expressing approval or admiration; commendation; laudation."
рҹҷҢрҹҸҫ,"raising hands: medium-dark skin tone. raising hands: medium-dark skin tone. hooray, hand, gesture, raised, medium-dark skin tone, celebration. The act of expressing approval or admiration; commendation; laudation."
рҹҷҢрҹҸҪ,"raising hands: medium skin tone. raising hands: medium skin tone. hooray, hand, gesture, raised, celebration, medium skin tone. The act of expressing approval or admiration; commendation; laudation."
рҹҷҢрҹҸј,"raising hands: medium-light skin tone. raising hands: medium-light skin tone. hooray, hand, medium-light skin tone, gesture, raised, celebration. The act of expressing approval or admiration; commendation; laudation."
рҹҷҢрҹҸ»,"raising hands: light skin tone. raising hands: light skin tone. hooray, light skin tone, hand, gesture, raised, celebration. The act of expressing approval or admiration; commendation; laudation."
рҹӨјвҖҚвҷҖпёҸ,"women wrestling. women wrestling. wrestle, women. A woman is a female human."
рҹ‘ЁвҖҚвқӨпёҸвҖҚрҹ‘Ё,"couple with heart: man, man. couple with heart: man, man. love, couple, man. A pair who associate with one another"
рҹғҸ,"joker. joker. wildcard, game, card. A playing card whose value can be determined by the person who holds it"
рҹҸҢрҹҸҪвҖҚвҷӮпёҸ,"man golfing: medium skin tone. man golfing: medium skin tone. golf, medium skin tone, man"
7пёҸвғЈ,keycap: 7. keycap: 7. keycap. A concept of quantity involving zero and units
рҹҸҠрҹҸ»вҖҚвҷӮпёҸ,"man swimming: light skin tone. man swimming: light skin tone. light skin tone, swim, man. Sexual maturity is the age or stage when an organism can reproduce."
3пёҸвғЈ,keycap: 3. keycap: 3. keycap. A concept of quantity involving zero and units
вӨө,"right arrow curving down. right arrow curving down. arrow, down. A mark to indicate a direction or relation"
вӨҙ,right arrow curving up. right arrow curving up. arrow. A mark to indicate a direction or relation
рҹӨёрҹҸҪвҖҚвҷӮпёҸ,"man cartwheeling: medium skin tone. man cartwheeling: medium skin tone. gymnastics, cartwheel, medium skin tone, man. A sport that involves exercises intended to display strength and balance and agility"
рҹ’ҮвҖҚвҷӮпёҸ,"man getting haircut. man getting haircut. man, haircut. Way hair is cut."
рҹҮёрҹҮҝ,Swaziland. Swaziland. flag. Emblem usually consisting of a rectangular piece of cloth of distinctive design
рҹҮёрҹҮҫ,Syria. Syria. flag. Emblem usually consisting of a rectangular piece of cloth of distinctive design
рҹҮёрҹҮҪ,"Sint Maarten. Sint Maarten. flag. Saint Martin is an island in the northeast Caribbean, approximately east of Puerto Rico."
рҹҷҚрҹҸјвҖҚвҷҖпёҸ,"woman frowning: medium-light skin tone. woman frowning: medium-light skin tone. frowning, medium-light skin tone, gesture, woman. A woman is a female human."
рҹҮёрҹҮ»,El Salvador. El Salvador. flag. Emblem usually consisting of a rectangular piece of cloth of distinctive design
рҹ‘®рҹҸҝвҖҚвҷҖпёҸ,"woman police officer: dark skin tone. woman police officer: dark skin tone. dark skin tone, officer, woman, police, cop. Any person in the armed services who holds a position of authority or command"
рҹӨҷрҹҸҝ,"call me hand: dark skin tone. call me hand: dark skin tone. dark skin tone, hand, call. A connection established over a telephone network between two parties."
рҹӨҷрҹҸҫ,"call me hand: medium-dark skin tone. call me hand: medium-dark skin tone. hand, medium-dark skin tone, call. A connection established over a telephone network between two parties."
рҹӨҷрҹҸҪ,"call me hand: medium skin tone. call me hand: medium skin tone. hand, call, medium skin tone. A connection established over a telephone network between two parties."
рҹҮёрҹҮ№,"SГЈo TomГ© & PrГӯncipe. SГЈo TomГ© & PrГӯncipe. flag. The flag of SГЈo TomГ© and PrГӯncipe consists of a red triangle situated at the hoist, with three horizontal green, yellow and green bands charged with two five-pointed black stars at the center."
рҹӨҷрҹҸј,"call me hand: medium-light skin tone. call me hand: medium-light skin tone. hand, medium-light skin tone, call. A connection established over a telephone network between two parties."
рҹҮёрҹҮё,South Sudan. South Sudan. flag. A republic in northeastern Africa on the Red Sea; achieved independence from Egypt and the United Kingdom in 1956
рҹӨҷрҹҸ»,"call me hand: light skin tone. call me hand: light skin tone. light skin tone, hand, call. A connection established over a telephone network between two parties."
рҹҮёрҹҮ·,"Suriname. Suriname. flag. The flag of Suriname is formed by five horizontal bands of green, white, red, white, and green."
рҹҮёрҹҮҙ,Somalia. Somalia. flag. A republic in extreme eastern Africa on the Somali peninsula; subject to tribal warfare
рҹ‘©рҹҸҫвҖҚвҡ•пёҸ,"woman health worker: medium-dark skin tone. woman health worker: medium-dark skin tone. doctor, nurse, medium-dark skin tone, healthcare, woman, therapist. A woman is a female human."
рҹҮёрҹҮі,Senegal. Senegal. flag. Official name of Senegal.
рҹҮёрҹҮІ,San Marino. San Marino. flag. Emblem usually consisting of a rectangular piece of cloth of distinctive design
рҹҮёрҹҮұ,"Sierra Leone. Sierra Leone. flag. The flag of Sierra Leone is a tricolor consisting of three horizontal green, white and blue bands."
рҹҮёрҹҮ°,Slovakia. Slovakia. flag. Emblem usually consisting of a rectangular piece of cloth of distinctive design
рҹҡ¶рҹҸјвҖҚвҷӮпёҸ,"man walking: medium-light skin tone. man walking: medium-light skin tone. walk, medium-light skin tone, hike, man. Sexual maturity is the age or stage when an organism can reproduce."
рҹҷ…вҖҚвҷӮпёҸ,"man gesturing NO. man gesturing NO. hand, forbidden, gesture, prohibited, no, man. That part of the fore limb below the forearm or wrist in primates (including humans)."
рҹҡЈрҹҸ»вҖҚвҷҖпёҸ,"woman rowing boat: light skin tone. woman rowing boat: light skin tone. rowboat, light skin tone, woman, boat. A woman is a female human."
рҹҮёрҹҮҜ,Svalbard & Jan Mayen. Svalbard & Jan Mayen. flag. Emblem usually consisting of a rectangular piece of cloth of distinctive design
рҹҮёрҹҮ®,Slovenia. Slovenia. flag. Emblem usually consisting of a rectangular piece of cloth of distinctive design
рҹҮёрҹҮӯ,St. Helena. St. Helena. flag. Emblem usually consisting of a rectangular piece of cloth of distinctive design
рҹҮёрҹҮ¬,Singapore. Singapore. flag. Emblem usually consisting of a rectangular piece of cloth of distinctive design
рҹҮёрҹҮӘ,Sweden. Sweden. flag. Emblem usually consisting of a rectangular piece of cloth of distinctive design
рҹҸӢрҹҸ»вҖҚвҷҖпёҸ,"woman lifting weights: light skin tone. woman lifting weights: light skin tone. light skin tone, weight lifter, woman"
рҹҮёрҹҮ©,Sudan. Sudan. flag. A republic in northeastern Africa on the Red Sea; achieved independence from Egypt and the United Kingdom in 1956
рҹҮёрҹҮЁ,Seychelles. Seychelles. flag. A republic on the Seychelles islands; achieved independence from the United Kingdom in 1976
рҹҮёрҹҮ§,Solomon Islands. Solomon Islands. flag. A country in Melanesia.
рҹҮёрҹҮҰ,Saudi Arabia. Saudi Arabia. flag. Emblem usually consisting of a rectangular piece of cloth of distinctive design
вӣ№рҹҸ»вҖҚвҷӮпёҸ,"man bouncing ball: light skin tone. man bouncing ball: light skin tone. light skin tone, ball, man"
рҹҷҚрҹҸҝ,"person frowning: dark skin tone. person frowning: dark skin tone. dark skin tone, gesture, frown. A woman is a female human."
рҹҷҚрҹҸҫ,"person frowning: medium-dark skin tone. person frowning: medium-dark skin tone. gesture, medium-dark skin tone, frown. A woman is a female human."
рҹҷҚрҹҸҪ,"person frowning: medium skin tone. person frowning: medium skin tone. gesture, frown, medium skin tone. A woman is a female human."
рҹ’ҒрҹҸҫвҖҚвҷҖпёҸ,"woman tipping hand: medium-dark skin tone. woman tipping hand: medium-dark skin tone. sassy, medium-dark skin tone, woman, tipping hand. A woman is a female human."
рҹӨ№рҹҸҪвҖҚвҷҖпёҸ,"woman juggling: medium skin tone. woman juggling: medium skin tone. multitask, juggling, woman, medium skin tone. A woman is a female human."
рҹҷҚрҹҸј,"person frowning: medium-light skin tone. person frowning: medium-light skin tone. medium-light skin tone, gesture, frown. A woman is a female human."
рҹҷҚрҹҸ»,"person frowning: light skin tone. person frowning: light skin tone. light skin tone, gesture, frown. A woman is a female human."
рҹӨ·рҹҸ»вҖҚвҷҖпёҸ,"woman shrugging: light skin tone. woman shrugging: light skin tone. light skin tone, woman, indifference, shrug, ignorance, doubt. A woman is a female human."
рҹ‘©рҹҸҪвҖҚрҹ”¬,"woman scientist: medium skin tone. woman scientist: medium skin tone. mathematician, engineer, woman, physicist, chemist, biologist, scientist, medium skin tone. A woman is a female human."
рҹ‘©рҹҸҪвҖҚрҹ”§,"woman mechanic: medium skin tone. woman mechanic: medium skin tone. electrician, tradesperson, plumber, woman, mechanic, medium skin tone. A woman is a female human."
рҹҷҮрҹҸҝвҖҚвҷӮпёҸ,"man bowing: dark skin tone. man bowing: dark skin tone. favor, dark skin tone, apology, gesture, sorry, bowing, man. Remorse is an emotional expression of personal regret felt by a person after he or she has committed an act which they deem to be shameful, hurtful, or violent."
рҹҮ№рҹҮҝ,"Tanzania. Tanzania. flag. The flag of Tanzania consists of a yellow-edged black diagonal band divided diagonally from the lower hoist-side corner, with a green upper triangle and blue lower triangle."
рҹҮ№рҹҮј,Taiwan. Taiwan. flag. Emblem usually consisting of a rectangular piece of cloth of distinctive design
рҹҮ№рҹҮ»,Tuvalu. Tuvalu. flag. Emblem usually consisting of a rectangular piece of cloth of distinctive design
рҹҮ№рҹҮ№,Trinidad & Tobago. Trinidad & Tobago. flag. Tobago is the smaller of the two main islands that make up the Republic of Trinidad and Tobago.
рҹҮ№рҹҮ·,Turkey. Turkey. flag. Emblem usually consisting of a rectangular piece of cloth of distinctive design
рҹ‘©рҹҸҫвҖҚвҡ–пёҸ,"woman judge: medium-dark skin tone. woman judge: medium-dark skin tone. judge, medium-dark skin tone, woman, scales. A woman is a female human."
рҹҮ№рҹҮҙ,Tonga. Tonga. flag. Emblem usually consisting of a rectangular piece of cloth of distinctive design
рҹҮ№рҹҮі,Tunisia. Tunisia. flag. Emblem usually consisting of a rectangular piece of cloth of distinctive design
рҹҮ№рҹҮІ,Turkmenistan. Turkmenistan. flag. Emblem usually consisting of a rectangular piece of cloth of distinctive design
рҹҮ№рҹҮұ,Timor-Leste. Timor-Leste. flag. An island in the Sundas
рҹҮ№рҹҮ°,Tokelau. Tokelau. flag. Emblem usually consisting of a rectangular piece of cloth of distinctive design
рҹ‘ірҹҸјвҖҚвҷҖпёҸ,"woman wearing turban: medium-light skin tone. woman wearing turban: medium-light skin tone. turban, medium-light skin tone, woman. A woman is a female human."
рҹҮ№рҹҮҜ,Tajikistan. Tajikistan. flag. Emblem usually consisting of a rectangular piece of cloth of distinctive design
рҹҮ№рҹҮӯ,"Thailand. Thailand. flag. The flag of the Kingdom of Thailand shows five horizontal stripes in the colors red, white, blue, white and red, with the central blue stripe being twice as wide as each of the other four."
рҹҮ№рҹҮ¬,"Togo. Togo. flag. The flag of Togo was adopted on April 27, 1960."
рҹҮ№рҹҮ«,French Southern Territories. French Southern Territories. flag. Emblem usually consisting of a rectangular piece of cloth of distinctive design
В®,registered. registered. registered. A visible indication.
рҹҮ№рҹҮ©,Chad. Chad. flag. Emblem usually consisting of a rectangular piece of cloth of distinctive design
рҹҮ№рҹҮЁ,Turks & Caicos Islands. Turks & Caicos Islands. flag. The flag of the Turks and Caicos Islands is similar to the flags of other British dependencies and colonies as it has the Union Flag in the canton.
рҹҮ№рҹҮҰ,Tristan da Cunha. Tristan da Cunha. flag. Group of British islands in the south Atlantic Ocean.
В©,"copyright. copyright. copyright. The right of a person or entity to use software in a particular way, as described in the terms of the license agreement. Copyright law also limits how a person may use the software. A person needs a license agreement for each software program they use."
рҹҷҺрҹҸҝ,"person pouting: dark skin tone. person pouting: dark skin tone. dark skin tone, pouting, gesture. A woman is a female human."
рҹҷҺрҹҸҫ,"person pouting: medium-dark skin tone. person pouting: medium-dark skin tone. pouting, gesture, medium-dark skin tone. A woman is a female human."
рҹҷҺрҹҸҪ,"person pouting: medium skin tone. person pouting: medium skin tone. pouting, gesture, medium skin tone. A woman is a female human."
рҹҷҺрҹҸј,"person pouting: medium-light skin tone. person pouting: medium-light skin tone. pouting, medium-light skin tone, gesture. A woman is a female human."
рҹҷҺрҹҸ»,"person pouting: light skin tone. person pouting: light skin tone. light skin tone, pouting, gesture. A woman is a female human."
рҹ‘ЁрҹҸҝвҖҚрҹ’ј,"man office worker: dark skin tone. man office worker: dark skin tone. dark skin tone, manager, business, office, architect, white-collar, man. A person who designs, as profession."
рҹ‘ЁрҹҸҝвҖҚрҹ’»,"man technologist: dark skin tone. man technologist: dark skin tone. dark skin tone, coder, developer, software, technologist, inventor, man. Someone who is the first to think of or make something."
рҹ‘ЁрҹҸ»вҖҚрҹ’ј,"man office worker: light skin tone. man office worker: light skin tone. light skin tone, manager, business, office, architect, white-collar, man. A person who designs, as profession."
рҹӨјвҖҚвҷӮпёҸ,"men wrestling. men wrestling. wrestle, men. A close hand-to-hand struggle."
рҹ‘ЁрҹҸ»вҖҚрҹ’»,"man technologist: light skin tone. man technologist: light skin tone. light skin tone, coder, developer, software, technologist, inventor, man. Someone who is the first to think of or make something."
рҹ‘ҶрҹҸҝ,"backhand index pointing up: dark skin tone. backhand index pointing up: dark skin tone. up, point, dark skin tone, hand, backhand, index, finger. The finger next to the thumb"
рҹ‘ҶрҹҸҫ,"backhand index pointing up: medium-dark skin tone. backhand index pointing up: medium-dark skin tone. up, point, hand, backhand, index, medium-dark skin tone, finger. The finger next to the thumb"
рҹ‘ҶрҹҸҪ,"backhand index pointing up: medium skin tone. backhand index pointing up: medium skin tone. up, point, hand, backhand, index, finger, medium skin tone. The finger next to the thumb"
рҹ‘ҶрҹҸј,"backhand index pointing up: medium-light skin tone. backhand index pointing up: medium-light skin tone. up, point, hand, backhand, index, medium-light skin tone, finger. The finger next to the thumb"
рҹ‘ҶрҹҸ»,"backhand index pointing up: light skin tone. backhand index pointing up: light skin tone. up, point, light skin tone, hand, backhand, index, finger. The finger next to the thumb"
рҹӣ¶,"canoe. canoe. canoe, boat. A small long and narrow boat, propelled by one or more people (depending on the size of canoe), using single-bladed paddles. The paddlers face in the direction of travel, in either a seated position, or kneeling on the bottom of the boat. Canoes are open on top, and pointed at both ends."
рҹӣө,"motor scooter. motor scooter. scooter, motor. A small motorcycle with a step-through frame and a platform for the feet."
рҹӣҙ,"kick scooter. kick scooter. scooter, kick. A kick scooter, push scooter or scooter, is a human-powered land vehicle with a handlebar, deck and wheels that is propelled by a rider pushing off the ground."
рҹӣі,"passenger ship. passenger ship. passenger, ship. A ship is a large buoyant watercraft."
рҹҸ„рҹҸјвҖҚвҷҖпёҸ,"woman surfing: medium-light skin tone. woman surfing: medium-light skin tone. medium-light skin tone, woman, surfing. A woman is a female human."
рҹӣ°,satellite. satellite. space. Satellite navigation system
рҹ‘ЁрҹҸјвҖҚрҹҸӯ,"man factory worker: medium-light skin tone. man factory worker: medium-light skin tone. industrial, factory, assembly, medium-light skin tone, worker, man. A member of the working class (not necessarily employed)"
рҹ‘ЁрҹҸјвҖҚрҹҸ«,"man teacher: medium-light skin tone. man teacher: medium-light skin tone. instructor, professor, medium-light skin tone, teacher, man. A person who, or a thing which, educates"
рҹӣ¬,"airplane arrival. airplane arrival. landing, arriving, airplane, arrivals, aeroplane. An aerodrome or airdrome is a location from which aircraft flight operations take place, regardless of whether they involve cargo, passengers, or neither."
рҹӣ«,"airplane departure. airplane departure. airplane, check-in, departures, departure, aeroplane. The act of checking in at a hotel, airport etc"
рҹҡҙрҹҸҝвҖҚвҷҖпёҸ,"woman biking: dark skin tone. woman biking: dark skin tone. dark skin tone, bicycle, cyclist, woman, biking. A woman is a female human."
рҹӣ©,"small airplane. small airplane. airplane, aeroplane. A facility consisting of the means and equipment necessary for the movement of passengers or goods"
рҹӣҘ,"motor boat. motor boat. motorboat, boat. A ship is a large buoyant watercraft."
рҹӣӨ,"railway track. railway track. railway, train. The permanent way; the rails."
рҹӣЈ,"motorway. motorway. road, highway. The highest-grade type of highway with access ramps, lane dividers, etc., for high-speed traffic"
рҹӣў,"oil drum. oil drum. drum, oil. A dark oil consisting mainly of hydrocarbons"
рҹӣЎ,shield. shield. weapon
рҹ‘ЁрҹҸҫвҖҚвңҲпёҸ,"man pilot: medium-dark skin tone. man pilot: medium-dark skin tone. plane, medium-dark skin tone, pilot, man. Person actively involved in flying an aircraft"
рҹӣ ,"hammer and wrench. hammer and wrench. hammer, tool, wrench, spanner. A hand tool"
рҹҷҚрҹҸјвҖҚвҷӮпёҸ,"man frowning: medium-light skin tone. man frowning: medium-light skin tone. frowning, medium-light skin tone, gesture, man. Wrinkling of the brows or face."
рҹ‘®рҹҸҝвҖҚвҷӮпёҸ,"man police officer: dark skin tone. man police officer: dark skin tone. dark skin tone, officer, police, man, cop. Any person in the armed services who holds a position of authority or command"
рҹҡЈрҹҸ»вҖҚвҷӮпёҸ,"man rowing boat: light skin tone. man rowing boat: light skin tone. rowboat, light skin tone, man, boat. A small boat of shallow draft with cross thwarts for seats and rowlocks for oars with which it is propelled"
рҹӣ’,"shopping cart. shopping cart. trolley, shopping, cart. Recently bought goods."
рҹӣ‘,"stop sign. stop sign. sign, stop, octagonal. An eight-sided polygon"
рҹӣҗ,"place of worship. place of worship. worship, religion. A place for public (especially Christian) worship"
рҹӣҸ,"bed. bed. sleep, hotel. A natural and periodic state of rest during which consciousness of the world is suspended"
рҹҸӢрҹҸ»вҖҚвҷӮпёҸ,"man lifting weights: light skin tone. man lifting weights: light skin tone. light skin tone, weight lifter, man"
рҹӣҺ,"bellhop bell. bellhop bell. bell, bellhop, hotel. Someone employed as an errand boy and luggage carrier around hotels"
рҹӣҚ,"shopping bags. shopping bags. bag, shopping, hotel. A shopping mall, shopping center/centre, shopping arcade, shopping precinct, or simply just a mall is one or more buildings forming a complex of shops representing merchandisers, with interconnecting walkways enabling visitors to walk from unit to unit."
рҹӣҢ,"person in bed. person in bed. sleep, hotel. A natural and periodic state of rest during which consciousness of the world is suspended"
рҹҡҙвҖҚвҷҖпёҸ,"woman biking. woman biking. bicycle, cyclist, woman, biking. A woman is a female human."
рҹӣӢ,"couch and lamp. couch and lamp. couch, hotel, lamp. A furniture set of sofas and chairs"
рҹӣ…,"left luggage. left luggage. luggage, baggage, locker. Metal device shaped in such a way that when it is inserted into the appropriate lock the lock's mechanism can be rotated"
рҹӣ„,"baggage claim. baggage claim. claim, baggage. Movement from one place to another"
рҹҷҸрҹҸҝ,"folded hands: dark skin tone. folded hands: dark skin tone. please, hand, ask, bow, pray, folded, dark skin tone, gesture, thanks. That part of the fore limb below the forearm or wrist in primates (including humans)."
рҹӣғ,customs. customs. customs. A document issued by a country to a citizen allowing that person to travel abroad and re-enter the home country
рҹҷҸрҹҸҫ,"folded hands: medium-dark skin tone. folded hands: medium-dark skin tone. please, hand, ask, bow, pray, medium-dark skin tone, folded, gesture, thanks. That part of the fore limb below the forearm or wrist in primates (including humans)."
рҹӣӮ,"passport control. passport control. passport, control. A document issued by a country to a citizen allowing that person to travel abroad and re-enter the home country"
рҹҷҸрҹҸҪ,"folded hands: medium skin tone. folded hands: medium skin tone. please, hand, ask, bow, pray, folded, medium skin tone, gesture, thanks. That part of the fore limb below the forearm or wrist in primates (including humans)."
рҹ’ҒрҹҸҫвҖҚвҷӮпёҸ,"man tipping hand: medium-dark skin tone. man tipping hand: medium-dark skin tone. sassy, medium-dark skin tone, tipping hand, man. Sexual maturity is the age or stage when an organism can reproduce."
рҹӣҒ,bathtub. bathtub. bath. A plumbing fixture that sprays water over you
рҹҷҸрҹҸј,"folded hands: medium-light skin tone. folded hands: medium-light skin tone. please, hand, ask, medium-light skin tone, bow, pray, folded, gesture, thanks. That part of the fore limb below the forearm or wrist in primates (including humans)."
рҹӣҖ,"person taking bath. person taking bath. bathtub, bath. A plumbing fixture that sprays water over you"
рҹӨ№рҹҸҪвҖҚвҷӮпёҸ,"man juggling: medium skin tone. man juggling: medium skin tone. multitask, juggling, medium skin tone, man. Juggling is a physical skill, performed by a juggler, involving the manipulation of objects for recreation, entertainment, art, or sport."
рҹҷҸрҹҸ»,"folded hands: light skin tone. folded hands: light skin tone. please, hand, ask, light skin tone, bow, pray, folded, gesture, thanks. That part of the fore limb below the forearm or wrist in primates (including humans)."
рҹӨҰрҹҸјвҖҚвҷҖпёҸ,"woman facepalming: medium-light skin tone. woman facepalming: medium-light skin tone. medium-light skin tone, exasperation, disbelief, woman, facepalm. A woman is a female human."
рҹҡҝ,shower. shower. water. A plumbing fixture that sprays water over you
рҹҡҫ,"water closet. water closet. water, lavatory, wc, restroom, closet. A room or building equipped with one or more toilets"
рҹҡҪ,toilet. toilet. toilet. A room or building equipped with one or more toilets
рҹӨ·рҹҸ»вҖҚвҷӮпёҸ,"man shrugging: light skin tone. man shrugging: light skin tone. light skin tone, indifference, shrug, ignorance, man, doubt. A gesture involving the shoulders"
рҹҡј,"baby symbol. baby symbol. baby, changing. Young child"
рҹҡ»,"restroom. restroom. lavatory, wc, restroom. (plural) any group of human beings (men or women or children) collectively"
рҹҡә,"womenвҖҷs room. womenвҖҷs room. lavatory, woman, wc, restroom. A woman is a female human."
рҹ‘ҮрҹҸҝ,"backhand index pointing down: dark skin tone. backhand index pointing down: dark skin tone. point, dark skin tone, hand, backhand, index, finger, down. One of the long extremities of the hand, sometimes excluding the thumb."
рҹ‘ҮрҹҸҫ,"backhand index pointing down: medium-dark skin tone. backhand index pointing down: medium-dark skin tone. point, hand, backhand, index, medium-dark skin tone, finger, down. One of the long extremities of the hand, sometimes excluding the thumb."
рҹ‘ҮрҹҸҪ,"backhand index pointing down: medium skin tone. backhand index pointing down: medium skin tone. point, hand, backhand, index, finger, medium skin tone, down. One of the long extremities of the hand, sometimes excluding the thumb."
