emoji,description
рҹҷ…рҹҸҝвҖҚвҷҖпёҸ,"woman gesturing NO: dark skin tone. woman gesturing NO: dark skin tone. dark skin tone, hand, forbidden, gesture, woman, prohibited, no. A woman is a female human."
рҹ’ӮрҹҸҝвҖҚвҷҖпёҸ,"woman guard: dark skin tone. woman guard: dark skin tone. dark skin tone, woman, guard. A woman is a female human."
рҹҸғвҖҚвҷҖпёҸ,"woman running. woman running. racing, running, woman, marathon. A woman is a female human."
рҹӨёрҹҸјвҖҚвҷҖпёҸ,"woman cartwheeling: medium-light skin tone. woman cartwheeling: medium-light skin tone. gymnastics, medium-light skin tone, woman, cartwheel. A woman is a female human."
рҹҸҢпёҸвҖҚвҷҖпёҸ,"woman golfing. woman golfing. woman, golf. A woman is a female human."
0пёҸвғЈ,"keycap: 0. keycap: 0. keycap. Wiktionary, the free dictionary, has entries for: aught cipher duck love nada naught nil nought o ought zero zilch zip There are several names for the number 0 in English, and concomitant names for the decades where the tens column contains the number 0."
рҹҸғрҹҸҫвҖҚвҷҖпёҸ,"woman running: medium-dark skin tone. woman running: medium-dark skin tone. racing, running, medium-dark skin tone, woman, marathon. A woman is a female human."
рҹ‘ЁрҹҸҫвҖҚрҹҢҫ,"man farmer: medium-dark skin tone. man farmer: medium-dark skin tone. farmer, gardener, medium-dark skin tone, rancher, man. Person who grows then harvests food"
рҹ‘ҸрҹҸҝ,"clapping hands: dark skin tone. clapping hands: dark skin tone. dark skin tone, clap, hand. The act of applauding; approbation and praise publicly expressed by the clapping of hands, stamping or tapping of the feet, acclamation, huzzas, or other means; marked commendation."
рҹ‘ҸрҹҸҫ,"clapping hands: medium-dark skin tone. clapping hands: medium-dark skin tone. clap, hand, medium-dark skin tone. The act of applauding; approbation and praise publicly expressed by the clapping of hands, stamping or tapping of the feet, acclamation, huzzas, or other means; marked commendation."
рҹ‘ҸрҹҸҪ,"clapping hands: medium skin tone. clapping hands: medium skin tone. clap, hand, medium skin tone. The act of applauding; approbation and praise publicly expressed by the clapping of hands, stamping or tapping of the feet, acclamation, huzzas, or other means; marked commendation."
рҹ‘ҸрҹҸј,"clapping hands: medium-light skin tone. clapping hands: medium-light skin tone. clap, hand, medium-light skin tone. The act of applauding; approbation and praise publicly expressed by the clapping of hands, stamping or tapping of the feet, acclamation, huzzas, or other means; marked commendation."
рҹ‘ҸрҹҸ»,"clapping hands: light skin tone. clapping hands: light skin tone. clap, light skin tone, hand. The act of applauding; approbation and praise publicly expressed by the clapping of hands, stamping or tapping of the feet, acclamation, huzzas, or other means; marked commendation."
рҹҡ¶рҹҸ»вҖҚвҷҖпёҸ,"woman walking: light skin tone. woman walking: light skin tone. walk, light skin tone, woman, hike. A woman is a female human."
рҹ‘ЁрҹҸјвҖҚрҹҡ’,"man firefighter: medium-light skin tone. man firefighter: medium-light skin tone. firetruck, medium-light skin tone, firefighter, man. Two or more persons trained to put out fires."
рҹҰ‘,"squid. squid. squid, molusc, food. Mediterranean food"
рҹҰҗ,"shrimp. shrimp. small, shrimp, shellfish, food. Any of many swimming, often edible crustaceans, chiefly of the infraorder Caridea or the suborder Dendrobranchiata, with slender legs, long whiskers and a long abdomen."
рҹҰҸ,"rhinoceros. rhinoceros. rhinoceros. A large herbivorous pachyderm of the family Rhinocerotidae, with thick, gray skin and one or two horns on their snouts."
рҹҰҺ,"lizard. lizard. lizard, reptile. Any cold-blooded vertebrate of the class Reptilia including tortoises, turtles, snakes, lizards, alligators, crocodiles, and extinct forms"
рҹҰҚ,"gorilla. gorilla. gorilla. Gorillas constitute the eponymous genus Gorilla, the largest extant genus of primates by physical size."
рҹҰҢ,deer. deer. deer. A female deer.
рҹҰӢ,"butterfly. butterfly. pretty, insect, butterfly. Insects are a class of invertebrates within the arthropod phylum that have a chitinous exoskeleton, a three-part body, three pairs of jointed legs, compound eyes and one pair of antennae."
рҹҰҠ,"fox face. fox face. fox, face. Part of the body at the front of the head"
рҹ‘ЁрҹҸјвҖҚрҹҡҖ,"man astronaut: medium-light skin tone. man astronaut: medium-light skin tone. rocket, medium-light skin tone, astronaut, man. Sexual maturity is the age or stage when an organism can reproduce."
рҹҰү,"owl. owl. wise, owl, bird. Ability to apply knowledge or experience or understanding or common sense and insight"
рҹҰҲ,"shark. shark. shark, fish. Superorder of fish"
рҹҰҮ,"bat. bat. bat, vampire. Immortal being which drinks the blood of mortals to survive."
рҹҰҶ,"duck. duck. duck, bird. Warm-blooded egg-laying vertebrates characterized by feathers and forelimbs modified as wings"
рҹҰ…,"eagle. eagle. eagle, bird. Warm-blooded egg-laying vertebrates characterized by feathers and forelimbs modified as wings"
рҹҰ„,"unicorn face. unicorn face. face, unicorn. Part of the body at the front of the head"
рҹ‘©вҖҚрҹ‘ҰвҖҚрҹ‘Ұ,"family: woman, boy, boy. family: woman, boy, boy. family, boy, woman. Primary social group; parents and children"
рҹҰғ,turkey. turkey. turkey. Warm-blooded egg-laying vertebrates characterized by feathers and forelimbs modified as wings
рҹҰӮ,"scorpion. scorpion. scorpio, zodiac, scorpius. Animals are multicellular, eukaryotic organisms of the kingdom Animalia."
рҹ’ҮрҹҸҫвҖҚвҷӮпёҸ,"man getting haircut: medium-dark skin tone. man getting haircut: medium-dark skin tone. medium-dark skin tone, man, haircut. Way hair is cut."
рҹҰҒ,"lion face. lion face. lion, face, zodiac, leo. Leo is the fifth astrological sign of the zodiac, originating from the constellation of Leo."
рҹ‘ЁвҖҚрҹ”¬,"man scientist. man scientist. mathematician, engineer, physicist, chemist, biologist, scientist, man. Professional practitioner of engineering"
рҹҰҖ,"crab. crab. cancer, zodiac. Animals are multicellular, eukaryotic organisms of the kingdom Animalia."
рҹ‘ЁрҹҸҪвҖҚвҡ–пёҸ,"man judge: medium skin tone. man judge: medium skin tone. justice, scales, medium skin tone, man. Judges are officials who presides over a court of law, either alone or as part of a panel, and make determinations about the applicability of the law to the facts presented."
рҹ‘ЁвҖҚрҹ”§,"man mechanic. man mechanic. electrician, tradesperson, plumber, mechanic, man. A skilled worker capable of building or repairing machinery. A mechanic can be compared to a technician, the distinction being that the technician is stronger in theory, the mechanic stronger in hands-on experience."
рҹ‘©вҖҚрҹ‘§,"family: woman, girl. family: woman, girl. family, woman, girl. Primary social group; parents and children"
рҹ‘©вҖҚрҹ‘Ұ,"family: woman, boy. family: woman, boy. family, boy, woman. Primary social group; parents and children"
рҹ‘©рҹҸҫвҖҚрҹ”¬,"woman scientist: medium-dark skin tone. woman scientist: medium-dark skin tone. mathematician, engineer, medium-dark skin tone, woman, physicist, chemist, biologist, scientist. A woman is a female human."
рҹ‘©рҹҸҫвҖҚрҹ”§,"woman mechanic: medium-dark skin tone. woman mechanic: medium-dark skin tone. electrician, tradesperson, plumber, medium-dark skin tone, woman, mechanic. A woman is a female human."
рҹҷӢрҹҸјвҖҚвҷҖпёҸ,"woman raising hand: medium-light skin tone. woman raising hand: medium-light skin tone. medium-light skin tone, gesture, woman, raising hand. A woman is a female human."
рҹҘһ,"pancakes. pancakes. pancake, hotcake, food, crГӘpe. Very thin pancake."
рҹҘқ,"kiwi fruit. kiwi fruit. fruit, kiwi, food. The ripened reproductive body of a seed plant"
рҹҘң,"peanuts. peanuts. vegetable, peanut, nut, food. Usually large hard-shelled seed"
рҹҘӣ,"glass of milk. glass of milk. drink, glass, milk. A white nutritious liquid secreted by mammals and used as food by human beings"
рҹҡөвҖҚвҷӮпёҸ,"man mountain biking. man mountain biking. bicycle, cyclist, bike, mountain, man. Off-road cycling using a mountain bike"
рҹҘҡ,"egg. egg. egg, food. Animal reproductive body consisting of an ovum or embryo together with nutritive and protective envelopes; especially the thin-shelled reproductive body laid by e.g. female birds"
рҹҘҷ,"stuffed flatbread. stuffed flatbread. stuffed, falafel, gyro, flatbread, kebab, food. Variety of skewered meals originating in the Middle East"
рҹҘҳ,"shallow pan of food. shallow pan of food. shallow, pan, paella, food, casserole. Saffron-flavored dish made of rice with shellfish and chicken"
рҹҘ—,"green salad. green salad. salad, green, food. A garden salad is a salad consisting mostly of fresh vegetables."
рҹҘ–,"baguette bread. baguette bread. french, bread, baguette, food. Narrow French stick loaf"
рҹҘ•,"carrot. carrot. carrot, vegetable, food. A yellow-orange, longish-rounded root vegetable, which is eaten raw or boiled."
рҹҘ”,"potato. potato. vegetable, potato, food. A tuberous plant, Solanum tuberosum, often eaten as a starchy vegetable, particularly in the Americas and Europe."
рҹҘ“,"bacon. bacon. bacon, meat, food. The edible flesh of animals, especially that of mammals."
рҹҘ’,"cucumber. cucumber. vegetable, cucumber, pickle, food. A vine in the gourd family, Cucumis sativus."
рҹҘ‘,"avocado. avocado. fruit, avocado, food. A pear-shaped tropical fruit with green or blackish skin and rich yellowish pulp enclosing a single large seed"
рҹ’ҶрҹҸјвҖҚвҷҖпёҸ,"woman getting massage: medium-light skin tone. woman getting massage: medium-light skin tone. medium-light skin tone, woman, face, massage. A woman is a female human."
рҹҘҗ,"croissant. croissant. french, bread, crescent roll, croissant, food. A staple food prepared by cooking a dough of flour and water and possibly more ingredients"
рҹҘӢ,"martial arts uniform. martial arts uniform. uniform, martial arts, taekwondo, judo, karate. If practiced in a manner which emphasizes self-defense."
рҹҘҠ,"boxing glove. boxing glove. boxing, glove. Boxing gloves are cushioned gloves that fighters wear on their hands during boxing matches."
рҹ‘©рҹҸҝвҖҚвңҲпёҸ,"woman pilot: dark skin tone. woman pilot: dark skin tone. dark skin tone, plane, woman, pilot. A woman is a female human."
рҹҷҺрҹҸҪвҖҚвҷӮпёҸ,"man pouting: medium skin tone. man pouting: medium skin tone. pouting, gesture, medium skin tone, man. Sexual maturity is the age or stage when an organism can reproduce."
рҹҘү,"3rd place medal. 3rd place medal. bronze, third, medal. A copper alloy, usually with tin as the main additive, but sometimes with other elements such as phosphorus, manganese, aluminium, or silicon. (source: Wikipedia)"
рҹҘҲ,"2nd place medal. 2nd place medal. second, medal, silver. A medal, or medallion, is, strictly speaking, a small, flat, and round piece of metal that has been sculpted, molded, cast, struck, stamped, or some way marked with an insignia, portrait, or other artistic rendering."
рҹҘҮ,"1st place medal. 1st place medal. gold, medal, first. The first or highest in an ordering or series"
рҹҘ…,"goal net. goal net. goal, net"
рҹҘ„,"spoon. spoon. tableware, spoon. Scooped utensil for eating (or serving)."
рҹҘғ,"tumbler glass. tumbler glass. whisky, liquor, shot, tumbler, glass. A traditional English folk-song"
рҹҘӮ,"clinking glasses. clinking glasses. celebrate, drink, clink, glass. Any drinkable liquid; a beverage."
рҹҘҒ,"drum. drum. drum, drumsticks, music. Someone who is passionate about music."
рҹҘҖ,"wilted flower. wilted flower. wilted, flower. The reproductive structure of angiosperm plants, consisting of stamens and carpels surrounded by petals and sepals all borne on the receptacle."
вӣ№рҹҸҝ,"person bouncing ball: dark skin tone. person bouncing ball: dark skin tone. dark skin tone, ball. Sport is all forms of usually competitive physical activity which, through casual or organised participation, aim to use, maintain or improve physical ability and skills while providing entertainment to participants, and in some cases, spectators."
вӣ№рҹҸҫ,"person bouncing ball: medium-dark skin tone. person bouncing ball: medium-dark skin tone. medium-dark skin tone, ball. Sport is all forms of usually competitive physical activity which, through casual or organised participation, aim to use, maintain or improve physical ability and skills while providing entertainment to participants, and in some cases, spectators."
вӣ№рҹҸҪ,"person bouncing ball: medium skin tone. person bouncing ball: medium skin tone. ball, medium skin tone. Sport is all forms of usually competitive physical activity which, through casual or organised participation, aim to use, maintain or improve physical ability and skills while providing entertainment to participants, and in some cases, spectators."
рҹӨҫ,"person playing handball. person playing handball. ball, handball. A testicle of a vertebrate"
вӣ№рҹҸј,"person bouncing ball: medium-light skin tone. person bouncing ball: medium-light skin tone. medium-light skin tone, ball. Sport is all forms of usually competitive physical activity which, through casual or organised participation, aim to use, maintain or improve physical ability and skills while providing entertainment to participants, and in some cases, spectators."
рҹӨҪ,"person playing water polo. person playing water polo. water, polo. Chemical compound formed of molecules composed of two atoms of hydrogen and one of oxygen"
вӣ№рҹҸ»,"person bouncing ball: light skin tone. person bouncing ball: light skin tone. light skin tone, ball. Sport is all forms of usually competitive physical activity which, through casual or organised participation, aim to use, maintain or improve physical ability and skills while providing entertainment to participants, and in some cases, spectators."
рҹӨј,"people wrestling. people wrestling. wrestler, wrestle. A close hand-to-hand struggle."
рҹӨә,"person fencing. person fencing. sword, fencing, fencer. The art or sport of duelling with swords, especially the style that originated in Europe."
рҹ•өрҹҸҝвҖҚвҷҖпёҸ,"woman detective: dark skin tone. woman detective: dark skin tone. dark skin tone, sleuth, spy, woman, detective"
рҹӨ№,"person juggling. person juggling. skill, multitask, juggle, balance. A skill is the learned ability to carry out a task with pre-determined results often within a given amount of time, energy, or both."
рҹӨё,"person cartwheeling. person cartwheeling. gymnastics, cartwheel. A sport that involves exercises intended to display strength and balance and agility"
рҹ‘ҜвҖҚвҷӮпёҸ,"men with bunny ears partying. men with bunny ears partying. bunny ear, partying, men, dancer. A social gathering"
рҹӨ·,"person shrugging. person shrugging. indifference, shrug, ignorance, doubt. A gesture involving the shoulders"
рҹӨ¶,"Mrs. Claus. Mrs. Claus. claus, mother, mrs., celebration, christmas. Christmas is an annual commemoration of the birth of Jesus Christ and a widely observed cultural holiday, celebrated generally on December 25 by billions of people around the world."
рҹӨө,"man in tuxedo. man in tuxedo. tuxedo, man, groom. Sexual maturity is the age or stage when an organism can reproduce."
рҹӨҙ,prince. prince. prince. Male ruler or head of a principality.
рҹӨі,"selfie. selfie. selfie, phone, camera. A digital video device that is used for recording moving images and audio in a digital format."
рҹҸҢрҹҸјвҖҚвҷӮпёҸ,"man golfing: medium-light skin tone. man golfing: medium-light skin tone. medium-light skin tone, golf, man"
рҹӨ°,"pregnant woman. pregnant woman. woman, pregnant. The normal location for a pregnancy to occur"
рҹ‘івҖҚвҷҖпёҸ,"woman wearing turban. woman wearing turban. turban, woman. A woman is a female human."
рҹҷ…рҹҸҝвҖҚвҷӮпёҸ,"man gesturing NO: dark skin tone. man gesturing NO: dark skin tone. dark skin tone, hand, forbidden, gesture, prohibited, no, man. That part of the fore limb below the forearm or wrist in primates (including humans)."
рҹ’ӮрҹҸҝвҖҚвҷӮпёҸ,"man guard: dark skin tone. man guard: dark skin tone. dark skin tone, guard, man. Sexual maturity is the age or stage when an organism can reproduce."
рҹӨ§,"sneezing face. sneezing face. sneeze, gesundheit, face. Part of the body at the front of the head"
рҹӨҰ,"person facepalming. person facepalming. exasperation, disbelief, face, palm. Part of the body at the front of the head"
рҹӨҘ,"lying face. lying face. lie, face, pinocchio. Part of the body at the front of the head"
рҹӨӨ,"drooling face. drooling face. drooling, face. Saliva trickling from the mouth"
рҹӨЈ,"rolling on the floor laughing. rolling on the floor laughing. laugh, rolling, floor, face. Internet slang"
рҹӨў,"nauseated face. nauseated face. nauseated, face, vomit. Part of the body at the front of the head"
рҹҸғвҖҚвҷӮпёҸ,"man running. man running. racing, running, marathon, man. Any long and arduous undertaking"
рҹӨЎ,"clown face. clown face. face, clown. A person who amuses others by ridiculous behavior"
рҹӨ ,"cowboy hat face. cowboy hat face. cowgirl, hat, face, cowboy. Part of the body at the front of the head"
рҹӨёрҹҸјвҖҚвҷӮпёҸ,"man cartwheeling: medium-light skin tone. man cartwheeling: medium-light skin tone. gymnastics, medium-light skin tone, cartwheel, man. A sport that involves exercises intended to display strength and balance and agility"
рҹӨһ,"crossed fingers. crossed fingers. luck, hand, finger, cross. One of the long extremities of the hand, sometimes excluding the thumb."
рҹҸҢпёҸвҖҚвҷӮпёҸ,"man golfing. man golfing. golf, man. Playing golf"
рҹӨқ,"handshake. handshake. hand, shake, agreement, meeting, handshake. A handshake is a short ritual in which two people grasp one of each other's like hands, in most cases accompanied by a brief up and down movement of the grasped hands."
рҹӨң,"right-facing fist. right-facing fist. fist, rightwards. The raised fist is a symbol of solidarity and support."
рҹӨӣ,"left-facing fist. left-facing fist. leftwards, fist. The raised fist is a symbol of solidarity and support."
рҹӨҡ,"raised back of hand. raised back of hand. backhand, raised. A return made with the back of the hand facing the direction of the stroke"
рҹ‘ЁрҹҸҪвҖҚрҹҸӯ,"man factory worker: medium skin tone. man factory worker: medium skin tone. industrial, factory, assembly, worker, medium skin tone, man. A member of the working class (not necessarily employed)"
рҹ’ҶвҖҚвҷӮпёҸ,"man getting massage. man getting massage. face, massage, man. Part of the body at the front of the head"
рҹ‘ЁрҹҸҪвҖҚрҹҸ«,"man teacher: medium skin tone. man teacher: medium skin tone. instructor, professor, teacher, medium skin tone, man. A person who, or a thing which, educates"
рҹҸғрҹҸҫвҖҚвҷӮпёҸ,"man running: medium-dark skin tone. man running: medium-dark skin tone. racing, running, medium-dark skin tone, marathon, man. Any long and arduous undertaking"
рҹӨҷ,"call me hand. call me hand. hand, call. A connection established over a telephone network between two parties."
рҹӨҳ,"sign of the horns. sign of the horns. hand, horns, finger, rock-on. A look that is believed by many cultures to be able to cause injury or bad luck for the person at whom it is directed"
рҹӨ—,"hugging face. hugging face. hug, face, hugging. Part of the body at the front of the head"
рҹӨ–,"robot face. robot face. monster, face, robot. Part of the body at the front of the head"
рҹӨ•,"face with head-bandage. face with head-bandage. hurt, bandage, face, injury. Harm is a moral and legal concept encompassing anything that causes injury, damage, or loss."
рҹӨ”,"thinking face. thinking face. thinking, face. Part of the body at the front of the head"
рҹӨ“,"nerd face. nerd face. face, geek, nerd. Part of the body at the front of the head"
рҹӨ’,"face with thermometer. face with thermometer. thermometer, ill, sick, face. Inflammation of nose and pharynx."
рҹӨ‘,"money-mouth face. money-mouth face. mouth, money, face. Part of the body at the front of the head"
рҹӨҗ,"zipper-mouth face. zipper-mouth face. zipper, mouth, face. Part of the body at the front of the head"
рҹ‘ұрҹҸјвҖҚвҷҖпёҸ,"blond-haired woman: medium-light skin tone. blond-haired woman: medium-light skin tone. medium-light skin tone, woman, blonde. A woman is a female human."
рҹ‘©рҹҸҪвҖҚвҡ•пёҸ,"woman health worker: medium skin tone. woman health worker: medium skin tone. doctor, nurse, healthcare, woman, therapist, medium skin tone. A woman is a female human."
рҹӨҪрҹҸҫвҖҚвҷҖпёҸ,"woman playing water polo: medium-dark skin tone. woman playing water polo: medium-dark skin tone. medium-dark skin tone, woman, water polo. A woman is a female human."
рҹҡ¶рҹҸ»вҖҚвҷӮпёҸ,"man walking: light skin tone. man walking: light skin tone. walk, light skin tone, hike, man. Sexual maturity is the age or stage when an organism can reproduce."
рҹҷҶрҹҸҝвҖҚвҷҖпёҸ,"woman gesturing OK: dark skin tone. woman gesturing OK: dark skin tone. dark skin tone, hand, ok, gesture, woman. A woman is a female human."
рҹӨ№рҹҸјвҖҚвҷҖпёҸ,"woman juggling: medium-light skin tone. woman juggling: medium-light skin tone. multitask, juggling, medium-light skin tone, woman. A woman is a female human."
рҹҸ„рҹҸҫвҖҚвҷҖпёҸ,"woman surfing: medium-dark skin tone. woman surfing: medium-dark skin tone. medium-dark skin tone, woman, surfing. A woman is a female human."
рҹҸӮрҹҸҝ,"snowboarder: dark skin tone. snowboarder: dark skin tone. ski, dark skin tone, snowboard, snow. Sport is all forms of usually competitive physical activity which, through casual or organised participation, aim to use, maintain or improve physical ability and skills while providing entertainment to participants, and in some cases, spectators."
рҹҸӮрҹҸҫ,"snowboarder: medium-dark skin tone. snowboarder: medium-dark skin tone. ski, snowboard, medium-dark skin tone, snow. Sport is all forms of usually competitive physical activity which, through casual or organised participation, aim to use, maintain or improve physical ability and skills while providing entertainment to participants, and in some cases, spectators."
рҹҸӮрҹҸҪ,"snowboarder: medium skin tone. snowboarder: medium skin tone. ski, snowboard, snow, medium skin tone. Sport is all forms of usually competitive physical activity which, through casual or organised participation, aim to use, maintain or improve physical ability and skills while providing entertainment to participants, and in some cases, spectators."
рҹҸӮрҹҸј,"snowboarder: medium-light skin tone. snowboarder: medium-light skin tone. ski, snowboard, medium-light skin tone, snow. Sport is all forms of usually competitive physical activity which, through casual or organised participation, aim to use, maintain or improve physical ability and skills while providing entertainment to participants, and in some cases, spectators."
рҹҸӮрҹҸ»,"snowboarder: light skin tone. snowboarder: light skin tone. ski, light skin tone, snowboard, snow. Sport is all forms of usually competitive physical activity which, through casual or organised participation, aim to use, maintain or improve physical ability and skills while providing entertainment to participants, and in some cases, spectators."
рҹ‘ЁрҹҸҪвҖҚрҹҺЁ,"man artist: medium skin tone. man artist: medium skin tone. artist, palette, medium skin tone, man. A person whose creative work shows sensitivity and imagination"
в“Ӯ,"circled M. circled M. m, circle"
рҹ‘ЁрҹҸҪвҖҚрҹҺӨ,"man singer: medium skin tone. man singer: medium skin tone. entertainer, singer, actor, star, rock, medium skin tone, man. Person who sings, is able to sing, or earns a living by singing."
рҹ‘·рҹҸҝвҖҚвҷҖпёҸ,"woman construction worker: dark skin tone. woman construction worker: dark skin tone. dark skin tone, woman, worker, construction. A woman is a female human."
рҹ‘©рҹҸҪвҖҚвҡ–пёҸ,"woman judge: medium skin tone. woman judge: medium skin tone. judge, woman, scales, medium skin tone. A woman is a female human."
рҹ’ҶрҹҸјвҖҚвҷӮпёҸ,"man getting massage: medium-light skin tone. man getting massage: medium-light skin tone. medium-light skin tone, face, massage, man. Part of the body at the front of the head"
рҹҸҠрҹҸҝвҖҚвҷҖпёҸ,"woman swimming: dark skin tone. woman swimming: dark skin tone. dark skin tone, swim, woman. A woman is a female human."
рҹӨ·вҖҚвҷҖпёҸ,"woman shrugging. woman shrugging. woman, indifference, shrug, ignorance, doubt. A woman is a female human."
рҹ•өрҹҸҝвҖҚвҷӮпёҸ,"man detective: dark skin tone. man detective: dark skin tone. dark skin tone, sleuth, spy, detective, man"
